date,username,to,replies,retweets,favorites,text,geo,mentions,hashtags,id,permalink
2019-11-02 04:18:02,narendramodi,,723,2461,16555,"I would be in Bangkok, Thailand to participate in various @ASEAN related Summits including the ASEAN-India Summit, East Asia Summit and a meeting on RCEP negotiations. ASEAN related Summits are key elements of India’s foreign policy, most notably our Act East Policy. @ASEAN2019TH",,@ASEAN @ASEAN2019TH,,1190483180333260801,https://twitter.com/narendramodi/status/1190483180333260801
2019-11-01 13:17:38,narendramodi,,593,2516,18331,Took Chancellor Merkel to Gandhi Smriti in Delhi. The thoughts and principles of Mahatma Gandhi reverberate in Germany and inspire its citizens.pic.twitter.com/7EnjpUfnop,,,,1190256583554453504,https://twitter.com/narendramodi/status/1190256583554453504
2019-11-01 13:11:30,narendramodi,,254,1991,12131,Important MoUs were signed during Chancellor Merkel’s visit. These will further invigorate the India-Germany friendship. http://nm-4.com/0h08 pic.twitter.com/5NFbZAOeqg,,,,1190255040314793985,https://twitter.com/narendramodi/status/1190255040314793985
2019-11-01 13:05:03,narendramodi,,591,3241,23092,"India and Germany can work together in areas like artificial intelligence, skills, education and more. We welcome German cooperation in our plans for smart cities, e-moblility and harnessing water resources. 2 Defence corridors also bring many opportunities for German companies.pic.twitter.com/CWwO5K1W2N",,,,1190253419300179968,https://twitter.com/narendramodi/status/1190253419300179968
2019-11-01 13:03:46,narendramodi,,250,2130,13033,Today’s talks with Chancellor Merkel were extensive and fruitful. We reviewed the full range of India-Germany relations. Chancellor Merkel has distinguished herself as one of the most widely respected world leaders. She is also a great friend of India’s.pic.twitter.com/92JgCnCKNL,,,,1190253094161903617,https://twitter.com/narendramodi/status/1190253094161903617
2019-11-01 08:00:23,narendramodi,,585,2758,15117,Addressing the press with Chancellor Merkel.https://www.pscp.tv/w/cIvdlzMyMjExNTJ8MVBsSlFWRXpBb2R4RQf9QX7jJlYhQ_j65ZojUss9Vtb4rL9Q7oseqwnheVHJ …,,,,1190176746147999744,https://twitter.com/narendramodi/status/1190176746147999744
2019-11-01 02:08:26,narendramodi,,599,3094,19555,Karnataka Rajyotsava is a day to celebrate the outstanding contribution of Karnataka towards India’s progress. The state’s natural beauty and people’s warm-hearted nature are well known. Praying for Karnataka’s development in the times to come.,,,,1190088174732599297,https://twitter.com/narendramodi/status/1190088174732599297
2019-11-01 02:06:12,narendramodi,,1683,4935,28884,The highest contribution to the growth of the nation's celebration of the Rajyotsav divasave. Kannada and Kannada Nadu wide hrdayavantike famed beauty. Pray for the development in the coming days.,,,,1190087614990151685,https://twitter.com/narendramodi/status/1190087614990151685
2019-11-01 02:05:09,narendramodi,,380,2439,15340,"Valor and skills, young and very happy farmer, ancient culture and new state's foundation day techniques confluence residents of a home state. Continued marching the territory on the path of development are also invaluable contribution to the country's prosperity ahead.",,,,1190087350992306176,https://twitter.com/narendramodi/status/1190087350992306176
2019-11-01 02:04:05,narendramodi,,337,1990,12361,Warm greetings to the residents of the state's foundation day of Madhya Pradesh. I wish to move forward on this rich fulfilled and cultural heritage of natural resources the way the state continued to grow and develop.,,,,1190087079637577730,https://twitter.com/narendramodi/status/1190087079637577730
2019-11-01 02:02:23,narendramodi,,160,1432,8449,"On Kerala Piravi day, greetings to my sisters and brothers of Kerala. People from this state have made remarkable contributions to the nation. May the people of the state be happy and prosperous.",,,,1190086655178240001,https://twitter.com/narendramodi/status/1190086655178240001
2019-11-01 02:01:54,narendramodi,,234,1025,5528,"Kerala Formation Day of the brethren, with all my heart in the saheadari-. Keralites is given the best contributions to the country. The joy and Promotion kaliyatatte people in the state.",,,,1190086530200567808,https://twitter.com/narendramodi/status/1190086530200567808
2019-11-01 02:01:22,narendramodi,,364,2126,13666,Congratulations established Day wealthy state residents the state of natural beauty. I wish to move forward on the land development path confluence of diverse cultures a home.,,,,1190086399296331776,https://twitter.com/narendramodi/status/1190086399296331776
2019-10-31 14:59:27,narendramodi,,840,4722,29862,Here’s how a coffee table book and newsletter of LBSNAA were released in Kevadia.pic.twitter.com/CwDaV1K28F,,,,1189919820948500480,https://twitter.com/narendramodi/status/1189919820948500480
2019-10-31 14:50:34,narendramodi,,215,1851,10761,"Reiterated our commitment to end transfer posting Raj, which hampers the performance of officers. Also urged officials to follow the idea of ‘One District, One Problem, Total Solution’ as an effective means of ensuring long-standing issues are solved at the grassroots level.pic.twitter.com/9XSx1bjLhJ",,,,1189917584251998208,https://twitter.com/narendramodi/status/1189917584251998208
2019-10-31 14:46:44,narendramodi,,424,2923,17086,"The ‘Statue of Unity’ provided an ideal setting to interact with IAS probationers. Talked about the need to make governance even more people friendly, steps they can take to improve economies in places they are posted in and more.http://nm-4.com/7e08",,,,1189916620237557762,https://twitter.com/narendramodi/status/1189916620237557762
2019-10-31 14:42:42,narendramodi,,196,1787,11732,"Also heard valuable feedback from officers on how to make Aarambh an even more effective course. The discussions continued over lunch, where senior officials and myself sat with the youngsters and interacted with them.pic.twitter.com/baVrRt7Wig",,,,1189915604913967105,https://twitter.com/narendramodi/status/1189915604913967105
2019-10-31 14:34:49,narendramodi,,191,1569,8377,"During today’s session at Aarambh, heard presentations on key policy matters. I was amazed by the out of the box thinking of young officers. Their passion towards India’s growth was visible. In my speech, talked about the need to break free from mindless silos and hierarchies.pic.twitter.com/kTmqrlmqdY",,,,1189913622409105408,https://twitter.com/narendramodi/status/1189913622409105408
2019-10-31 14:30:46,narendramodi,,275,1596,7472,"Today, on the Jayanti of Sardar Patel, I joined a very innovative, special and refreshing programme, Aarambh. This is a new Foundation Training Course for young officers. This course is broad based and gives a more holistic canvas to bright officials. http://nm-4.com/ff08 pic.twitter.com/eJaEWOdpoT",,,,1189912603365130240,https://twitter.com/narendramodi/status/1189912603365130240
2019-10-31 14:25:19,narendramodi,,265,1939,11400,"Earlier today in Kevadia, inaugurated an exhibition in which our valiant police and paramilitary forces showcased tech innovations they are adopting. Sharing some glimpses from the exhibition.pic.twitter.com/keIv6DebKl",,,,1189911229378072576,https://twitter.com/narendramodi/status/1189911229378072576
2019-10-31 08:10:46,narendramodi,,805,3373,17969,"For decades we had made a temporary wall by Article 370 between the Indians. Our brothers and sisters on the other side of the temporary wall, he also lived in confusion. The wall was separatism and increased terrorism in Kashmir, so he went toppled wall. Pic.twitter.com/cktYZSOfMB",,,,1189816969891131393,https://twitter.com/narendramodi/status/1189816969891131393
2019-10-31 08:10:28,narendramodi,,459,3054,14250,"Which can not win the war with us, they are challenging our unity, we have to break it. But they forget that for centuries, despite such efforts, we could not find, could not defeat our unity. Something that would not fade celebrity. Pic.twitter.com/HwxnRcoHS8",,,,1189816895647690755,https://twitter.com/narendramodi/status/1189816895647690755
2019-10-31 08:09:28,narendramodi,,255,1901,8694,"Featuring Indian unity in diversity. Unity in diversity is our pride, our pride, identity. We the People of India, we Indians, these are not just words, not the beginning of our Constitution. These thousands reflection of the unity of Indians standing years https://youtu.be/MVUkGMLepzk",,,,1189816643544854528,https://twitter.com/narendramodi/status/1189816643544854528
2019-10-31 08:07:03,narendramodi,,253,1790,8356,"The way he came immense peace at any Sraddhasthl, get a new energy, the same sensation I came here Sardar Saheb. In a span OF A YEAR, were 'Statue OF Unity' has emerged as a global tourist Attractionkpicktvitrkcom/od9tb7ya9u4",,,,1189816037941878784,https://twitter.com/narendramodi/status/1189816037941878784
2019-10-31 08:06:11,narendramodi,,287,1982,12426,Splendid Ekta Parade in Kevadia. Have a look at some photos from the parade.pic.twitter.com/4qdeXCLsXU,,,,1189815818760212480,https://twitter.com/narendramodi/status/1189815818760212480
2019-10-31 08:00:24,narendramodi,,292,2134,11010,"Today in Kevadia, next to the ‘Statue of Unity’ we took the Rashtriya Ekta pledge. May this day inspire us to strengthen the bonds of unity, harmony and brotherhood in our society.pic.twitter.com/rL6BJIEUmk",,,,1189814362216767488,https://twitter.com/narendramodi/status/1189814362216767488
2019-10-31 06:27:21,narendramodi,,279,1580,10600,"Shri Gurudas Dasgupta Ji was one of the most committed and articulate proponents of his ideology. He was a strong voice in Parliament, whose interventions were keenly heard across the political spectrum. Saddened by his passing away. May his soul rest in peace.",,,,1189790945786638336,https://twitter.com/narendramodi/status/1189790945786638336
2019-10-31 04:58:10,narendramodi,,1940,8729,57120,"He was the stalwart who unified India. A leader of farmers, a great administrator and uncompromising when it came to safeguarding rights of the poor, India will always remember Sardar Patel’s unparalleled contribution. Paid tributes to him at the ‘Statue of Unity.’pic.twitter.com/t900IoQh4W",,,,1189768502267252736,https://twitter.com/narendramodi/status/1189768502267252736
2019-10-31 03:16:42,narendramodi,,807,3564,16460,India bows to Sardar Patel. Watch from Kevadia.https://www.pscp.tv/w/cIpJmjMyMjExNTJ8MVJEeGxOWWpCV3pHTLt0RB8k6TYa76KxzzZZU-4G5Oy1_5xhD1os3erPjytL …,,,,1189742967256309760,https://twitter.com/narendramodi/status/1189742967256309760
2019-10-31 01:13:53,narendramodi,,224,1427,10411,Best wishes to Assam CM @sarbanandsonwal Ji on his birthday. He is working tirelessly for the progress of Assam. May he lead a long and healthy life.,,@sarbanandsonwal,,1189712060940193792,https://twitter.com/narendramodi/status/1189712060940193792
2019-10-31 01:12:52,narendramodi,,834,2703,28448,The country's former prime minister Indira Gandhi humble tribute on his death anniversary.,,,,1189711802457833472,https://twitter.com/narendramodi/status/1189711802457833472
2019-10-31 00:56:24,narendramodi,,1955,10331,52174,Iron unifier of the country guy Sardar Patel salute hundred percent on his birth anniversary. Tributes to the great Sardar Patel on his Jayanti. His contribution to our nation is Monumentalkpicktvitrkcom/dns8arn9jbp,,,,1189707660448403459,https://twitter.com/narendramodi/status/1189707660448403459
2019-10-30 15:41:03,narendramodi,,392,2127,16228,Heartiest congratulations @alferdez on your impressive victory in the Presidential elections. Looking forward to working with you to further expand and deepen the strategic partnership between India and Argentina.,,@alferdez,,1189567901814185984,https://twitter.com/narendramodi/status/1189567901814185984
2019-10-30 15:39:43,narendramodi,,226,1249,8115,@Alferdez my warm congratulations for his victory in the presidential elections impressive. I look forward to working together to expand and deepen the strategic partnership between India and Argentina.,,@alferdez,,1189567567263944705,https://twitter.com/narendramodi/status/1189567567263944705
2019-10-29 20:54:45,narendramodi,,256,1719,10288,I would like to particularly thank His Majesty @KingSalman and His Royal Highness the Crown Prince for their hospitality. Interacting with them is always very special.pic.twitter.com/2DrqwNGhuS,,@KingSalman,,1189284457339129859,https://twitter.com/narendramodi/status/1189284457339129859
2019-10-29 20:54:34,narendramodi,,350,2084,13869,I am extremely grateful to the people and Government of Saudi Arabia for their excellent hospitality. I am honoured to have got an opportunity to address @FIIKSA. Interacting with the top leadership of Saudi Arabia was also very productive.,,@FIIKSA,,1189284413500280832,https://twitter.com/narendramodi/status/1189284413500280832
2019-10-29 20:52:32,narendramodi,,161,1239,7373,I feel a great gratitude to the Saudi people and government for the generosity of Alziavh.cservt that I had the opportunity to deliver a speech in front of FIIKSA @. The communication with senior leaders in Saudi Arabia very constructive.,,@,,1189283900218105856,https://twitter.com/narendramodi/status/1189283900218105856
2019-10-29 19:01:53,narendramodi,,309,2151,13133,It is always a delight to meet His Royal Highness Prince Mohammed bin Salman bin Abdulaziz. His vision for Saudi Arabia is remarkable. We had an extensive meeting during which we discussed numerous issues. Stronger friendship between our nations augurs well for our people.pic.twitter.com/33qiXnV7H7,,,,1189256053919305731,https://twitter.com/narendramodi/status/1189256053919305731
2019-10-29 19:00:07,narendramodi,,204,2146,9043,Always happier to meet with His Royal Highness Prince Mohammed bin Salman bin Abdulaziz. Has a distinct vision of the Queen of the Arab Alsaudih.akdna expanded meeting in which we discussed a large number of issues. The strong friendship between our two countries are working for the benefit of our peoples. Pic.twitter.com/ZAK16CcKMa,,,,1189255611202134016,https://twitter.com/narendramodi/status/1189255611202134016
2019-10-29 18:58:38,narendramodi,,157,1297,6886,Honoured to have addressed the @FIIKSA. Here are some pictures from the evening.pic.twitter.com/FWhUIUHoJ5,,@FIIKSA,,1189255238865342464,https://twitter.com/narendramodi/status/1189255238865342464
2019-10-29 18:56:02,narendramodi,,942,4310,24788,India has: Political stability. Predictable policies. Diverse markets. This is a great time to invest and do business in India.pic.twitter.com/kA0W9uPO6p,,,,1189254582414774272,https://twitter.com/narendramodi/status/1189254582414774272
2019-10-29 18:55:24,narendramodi,,203,1667,8689,The need of the hour today- compassion towards the environment.pic.twitter.com/9VuW61XJqs,,,,1189254422980898817,https://twitter.com/narendramodi/status/1189254422980898817
2019-10-29 18:54:52,narendramodi,,141,1477,7195,Infrastructure is an opportunity multiplier. We in India are leaving no stone unturned to build next-generation infrastructure.pic.twitter.com/EzyQdkvNBq,,,,1189254290017267713,https://twitter.com/narendramodi/status/1189254290017267713
2019-10-29 18:54:27,narendramodi,,170,1569,7727,Five trends that will influence global business in the 21st century.pic.twitter.com/brUZWhTTp2,,,,1189254185709199360,https://twitter.com/narendramodi/status/1189254185709199360
2019-10-29 16:40:36,narendramodi,,312,1992,12302,Called on His Majesty @KingSalman. He is one of the most widely respected leaders. We discussed multiple aspects relating to further boosting cooperation with Saudi Arabia.pic.twitter.com/ka4eArzHZj,,@KingSalman,,1189220501941604354,https://twitter.com/narendramodi/status/1189220501941604354
2019-10-29 16:35:13,narendramodi,,294,2786,14679,I met His Majesty KingSalman @. It is one of the most respected leaders at the level of Asa.naakecna various aspects associated with supporting future cooperation with the Kingdom of Saudi Arabia pic.twitter.com/f0sjtqLKE0.,,@,,1189219145822265345,https://twitter.com/narendramodi/status/1189219145822265345
2019-10-29 16:25:37,narendramodi,,216,1407,8193,"Interacted with HE Ahmad Bin Salman Al Rajhi, Saudi Arabia’s Minister of Labour and Social Development. A wide range of issues came up for discussion during our meeting. @MLSD_SApic.twitter.com/enBLdzpSCO",,@MLSD_SApic,,1189216731245494272,https://twitter.com/narendramodi/status/1189216731245494272
2019-10-29 16:22:32,narendramodi,,153,1049,6306,"Meeting with His Excellency the Saudi Minister of Manpower and Social Development Ahmed Bin Salman Al-Rajhi held. During the meeting, we dealt with a large number of the most important issues of efforts to empower communities and improve people's living standards. @ MLSD_SApic.twitter.com / ruMhYRxOLg",,@MLSD_SApic,,1189215951805440000,https://twitter.com/narendramodi/status/1189215951805440000
2019-10-29 15:07:59,narendramodi,,672,2988,13972,Speaking at @FIIKSA in Riyadh. Watch.https://www.pscp.tv/w/cIhNTzMyMjExNTJ8MXlOR2FwQUJXWERLaoEIwrQ8wvd7X92hAildp5xUppv1Jdei07ezIUsIwd_b …,,@FIIKSA,,1189197192554106880,https://twitter.com/narendramodi/status/1189197192554106880
2019-10-29 14:05:42,narendramodi,,281,1967,13268,Adding even more energy to the India-Saudi Arabia friendship. I had an excellent meeting with HRH Prince Abdulaziz bin Salman. Energy remains an important pillar of our ties.pic.twitter.com/qhwbfKl4bf,,,,1189181519937466370,https://twitter.com/narendramodi/status/1189181519937466370
2019-10-29 14:04:45,narendramodi,,311,1659,11835,The visit will contribute to support the bonds of friendship between India and Saudi Arabia. A meeting was held with a distinguished His Royal Highness Prince Abdul Aziz bin Salman.la energy sector continues to be an important pillar in the relations between our two countries. Pic.twitter.com/7ydlhk9wLg,,,,1189181280073764869,https://twitter.com/narendramodi/status/1189181280073764869
2019-10-29 13:43:43,narendramodi,,232,1572,9091,"Wonderful meeting with HE @AlfadleyA, Minister of Environment, Water and Agriculture. These are sectors in which there is a lot of potential for cooperation. We are committed to work together to make our environment better and effectively harness water resources. @MEWA_KSApic.twitter.com/berkfL6ROO",,@AlfadleyA @MEWA_KSApic,,1189175987336105986,https://twitter.com/narendramodi/status/1189175987336105986
2019-10-29 13:41:55,narendramodi,,173,1022,6067,Meeting wonderful with HE the Minister of Environment and Water @AlfadleyA and agriculture. There are more opportunities for joint cooperation held in these Alqtaat.thdtna ways to work together to make our environment better and make the best use of water resources @ MEWA_KSApic.twitter.com / RDxzbFRNyT,,@AlfadleyA @MEWA_KSApic,,1189175532610641921,https://twitter.com/narendramodi/status/1189175532610641921
2019-10-29 13:15:08,narendramodi,,297,2024,14810,Excellent meeting with His Majesty @KingAbdullahII in Riyadh. We discussed the full range of relations between India and Jordan.pic.twitter.com/fyLfGlaXhN,,@KingAbdullahII,,1189168794679332864,https://twitter.com/narendramodi/status/1189168794679332864
2019-10-29 13:14:02,narendramodi,,174,1365,10337,Excellent meeting with His Majesty KingAbdullahII @ in Ariyad.naakecna various aspects of cooperation between India and Jordan. Pic.twitter.com/2779r7PvcG,,@في,,1189168516508913665,https://twitter.com/narendramodi/status/1189168516508913665
2019-10-29 07:31:30,narendramodi,,561,3470,22460,"Sharing my interview with @arabnews, where I spoke about robust ties between India and Saudi Arabia, the reform trajectory in India, energy partnership and more. Do have a look.https://www.arabnews.com/node/1575756/saudi-arabia …",,@arabnews,,1189082314745241600,https://twitter.com/narendramodi/status/1189082314745241600
2019-10-29 05:59:32,narendramodi,,1672,5858,51632,The brothers and sisters of affection and love symbol Fiesta brother dooj you many congratulations to all. This sacred-sacred opportunity to make the relationship and deepen.,,,,1189059170848399360,https://twitter.com/narendramodi/status/1189059170848399360
2019-10-28 20:36:23,narendramodi,,690,3693,28845,"Landed in the Kingdom of Saudi Arabia, marking the start of an important visit aimed at strengthening ties with a valued friend. Will be taking part in a wide range of programmes during this visit.pic.twitter.com/3MskcllePr",,,,1188917448386469889,https://twitter.com/narendramodi/status/1188917448386469889
2019-10-28 20:35:00,narendramodi,,1856,9100,52064,It arrived in Saudi Arabia at the beginning of an important visit aimed at strengthening relations with a friendly country we cherish very much. Bus will be engaged in programs during the visit .pic.twitter.com / 6R80ZCFTVF,,,,1188917099386802180,https://twitter.com/narendramodi/status/1188917099386802180
2019-10-28 14:27:21,narendramodi,,363,1513,8403,"Yesterday’s #MannKiBaat covered topics such as festival tourism, Sardar Patel’s contribution, one year of the ‘Statue of Unity’ and the noble thoughts of Sri Guru Nanak Dev Ji. On the NaMo App is an interesting quiz based on the episode, which I invite you all to take part in.pic.twitter.com/zFZ9nhAFdc",,,#MannKiBaat,1188824578736476165,https://twitter.com/narendramodi/status/1188824578736476165
2019-10-28 14:24:49,narendramodi,BorisJohnson,329,3643,23391,PM @BorisJohnson wonderfully explains the essence of Diwali. I fully agree that Diwali brings all of us together. Also grateful to him for highlighting the contribution of Britain’s Indian community. Hope he too enjoyed the Samosas and sweets this festive season. :)https://twitter.com/BorisJohnson/status/1188190221302714369 …,,@BorisJohnson,,1188823939746713601,https://twitter.com/narendramodi/status/1188823939746713601
2019-10-28 14:22:01,narendramodi,netanyahu,429,4443,38108,"My dear friend Bibi, thank you for the Diwali greetings. Greetings to you as well. @netanyahuhttps://twitter.com/netanyahu/status/1188435685679779841 …",,@netanyahuhttps,,1188823237783736320,https://twitter.com/narendramodi/status/1188823237783736320
2019-10-28 14:21:29,narendramodi,realDonaldTrump,286,3455,23237,"As always, @POTUS @realDonaldTrump marks Diwali with great enthusiasm. Season’s greetings to him. May there always be brightness all around!https://twitter.com/realDonaldTrump/status/1188400389697212416 …",,@POTUS @realDonaldTrump,,1188823102244839425,https://twitter.com/narendramodi/status/1188823102244839425
2019-10-28 14:20:49,narendramodi,JustinTrudeau,130,1375,8721,Thoughtful greetings by PM @JustinTrudeau. May the special occasions of Diwali and Bandi Chhor Divas bring happiness and good health in everyone’s lives.https://twitter.com/JustinTrudeau/status/1188540270213763074 …,,@JustinTrudeau,,1188822933268942848,https://twitter.com/narendramodi/status/1188822933268942848
2019-10-28 14:19:01,narendramodi,PresidentRuvi,169,1848,14727,Grateful for the wishes @PresidentRuvi. May this festive season further the spirit of harmony and happiness.https://twitter.com/PresidentRuvi/status/1188490098020700167 …,,@PresidentRuvi,,1188822480401494022,https://twitter.com/narendramodi/status/1188822480401494022
2019-10-28 14:18:18,narendramodi,leehsienloong,140,1878,13596,"Very well said, PM @leehsienloong! I am sure the wonderful people of Singapore celebrated this festival with gusto.https://twitter.com/leehsienloong/status/1188259391775993856 …",,@leehsienloong,,1188822300461633536,https://twitter.com/narendramodi/status/1188822300461633536
2019-10-28 14:17:31,narendramodi,VP,194,1477,12173,"Greetings to you as well, @VP Pence.https://twitter.com/VP/status/1188520262683316227 …",,@VP,,1188822102079496193,https://twitter.com/narendramodi/status/1188822102079496193
2019-10-28 12:47:53,narendramodi,,453,2144,14661,"Fruitful interactions with MPs from the European Parliament. We exchanged views on boosting India-EU ties, the need to come together to fight terrorism and other issues. I spoke about steps being taken by the Government of India to boost ‘Ease of Living.’ http://nm-4.com/n4z8 pic.twitter.com/9y1ObOvL9e",,,,1188799546941329408,https://twitter.com/narendramodi/status/1188799546941329408
2019-10-28 11:47:51,narendramodi,,189,1581,10123,"Saudi Arabia and India are working together in a wide range of sectors notably energy, security, trade and culture. This visit will add strength to our bilateral relations.http://nm-4.com/04z8",,,,1188784438047494144,https://twitter.com/narendramodi/status/1188784438047494144
2019-10-28 11:47:50,narendramodi,,892,3569,28925,"I will be visiting the Kingdom of Saudi Arabia on the 29th, where I will be a part of various programmes including the Plenary Session of the 3rd Future Investment Initiative Forum being held in Riyadh. I will also meet His Majesty the King and Crown Prince.",,,,1188784436331958272,https://twitter.com/narendramodi/status/1188784436331958272
2019-10-28 11:27:08,narendramodi,,372,2096,8651,"Sujit much courage, the courage of the boy on the measures taken to recover safely pirarttikkirencujittaip for Wilson's first minister talked extensively with @EPSTamilNadu. All efforts are being made to protect cujittaip.",,@EPSTamilNadu,,1188779223969722369,https://twitter.com/narendramodi/status/1188779223969722369
2019-10-28 10:12:39,narendramodi,,1233,5089,31218,My prayers are with the young and brave Sujith Wilson. Spoke to CM @EPSTamilNadu regarding the rescue efforts underway to save Sujith. Every effort is being made to ensure that he is safe. @CMOTamilNadu,,@EPSTamilNadu @CMOTamilNadu,,1188760480741056513,https://twitter.com/narendramodi/status/1188760480741056513
