date,username,to,replies,retweets,favorites,text,geo,mentions,hashtags,id,permalink
2019-10-02 01:56:42,narendramodi,,1495,4960,25556,"Mahatma Gandhi salute hundred percent on his 150th birth anniversary. Tributes to beloved Bapu! On # Gndhil50, we express gratitude to Mahatma Gandhi for his everlasting contribution to humanity. We pledge to continue working hard to realise his dreams and create a better Planetkpicktvitrkcom/4y0ःkrbho762",,,#Gandhi150,1179213588822495232,https://twitter.com/narendramodi/status/1179213588822495232
2019-10-01 14:52:58,narendramodi,,1164,4317,25593,"Ayushmaan has been has been the first year-determination of India, is the dedication to learn. Pic.twitter.com/N7lo8znNne",,,,1179046552918097920,https://twitter.com/narendramodi/status/1179046552918097920
2019-10-01 14:52:33,narendramodi,,282,1937,9088,"In the years to come, we are making Ayushman Bharat even more people friendly. Today, we launched a mobile App that will help beneficiaries. The PM-JAY Start-up Challenge will give opportunities to youngsters to further innovation in healthcare.pic.twitter.com/pxaZnIs6nt",,,,1179046447892664323,https://twitter.com/narendramodi/status/1179046447892664323
2019-10-01 14:51:53,narendramodi,,563,2650,13321,"Long live the revolutionary actions of India, New India. Not only because, as these normal human in the country, has been playing an important role in saving the lives of the poor, but also because it also symbolizes the collective resolve and ability of 130 million people of India. Pic.twitter.com/JmXf95dj5r",,,,1179046279227179008,https://twitter.com/narendramodi/status/1179046279227179008
2019-10-01 14:51:40,narendramodi,,437,2307,11668,Healthy India is being built on four strong pillars. Pic.twitter.com/EX3jEaQAAJ,,,,1179046225900818433,https://twitter.com/narendramodi/status/1179046225900818433
2019-10-01 14:51:10,narendramodi,,216,1564,8100,"Had an excellent interaction with beneficiaries of Ayushman Bharat PM-JAY. I am delighted that this scheme has touched the lives of many across India, giving them better health and more happiness. @AyushmanNHApic.twitter.com/92FH2cwrwl",,@AyushmanNHApic,,1179046098771382272,https://twitter.com/narendramodi/status/1179046098771382272
2019-10-01 14:48:34,narendramodi,GovHolcomb,172,1529,10117,"Great meeting you, @GovHolcomb! India is delighted to work with the great state of Indiana! This will add immense strength to our ties with USA. Your passion towards sports and service is gladdening!https://twitter.com/GovHolcomb/status/1179011200408883200 …",,@GovHolcomb,,1179045443843395584,https://twitter.com/narendramodi/status/1179045443843395584
2019-10-01 14:45:47,narendramodi,,560,2496,25032,Called on Rashtrapati Ji and greeted him on his birthday. @rashtrapatibhvnpic.twitter.com/DCcXqPR8n5,,@rashtrapatibhvnpic,,1179044745890238464,https://twitter.com/narendramodi/status/1179044745890238464
2019-10-01 12:21:55,narendramodi,,1334,4128,22400,"One year of Ayushman Bharat, the largest healthcare programme in the world.https://www.pscp.tv/w/cGM8YzMyMjExNTJ8MXJtR1BYVnFXdk1HTg_bH9MVJln_tDrz_pyRRA_NKH-8O9YHEA9hO0N3B1kq …",,,,1179008541652205568,https://twitter.com/narendramodi/status/1179008541652205568
2019-10-01 02:11:01,narendramodi,,543,1645,8453,"#MannKiBaat September 2019 had an interesting mix of topics, which connected with a wide range of people. Did you hear the episode? If so, take part in this Quiz on the NaMo App.pic.twitter.com/6R3lNQauev",,,#MannKiBaat,1178854800508608512,https://twitter.com/narendramodi/status/1178854800508608512
2019-10-01 02:09:32,narendramodi,,782,4030,30022,Greetings to Rashtrapati Ji on his birthday. India has gained significantly from his insights and understanding of policy matters. One can always see his passion towards empowering the poor and downtrodden. May Almighty bless him with a long and healthy life. @rashtrapatibhvn,,@rashtrapatibhvn,,1178854426703888384,https://twitter.com/narendramodi/status/1178854426703888384
2019-10-01 02:07:53,narendramodi,,3451,10789,67725,The third form of Goddess Durga Navaratri of tritiya mother invocation phase Chandraghanta. Mother peace in life Chandraghanta we all welfare. Pic.twitter.com/lcoukHBTmD,,,,1178854013392916480,https://twitter.com/narendramodi/status/1178854013392916480
2019-09-30 14:47:07,narendramodi,,3738,4463,28231,Spoke to Bihar CM @NitishKumar Ji regarding the flood situation in parts of the state. Agencies are working with local administration to assist the affected. Centre stands ready to provide all possible further assistance that may be required.,,@NitishKumar,,1178682693753552896,https://twitter.com/narendramodi/status/1178682693753552896
2019-09-30 14:00:51,narendramodi,,589,2750,14922,My request to the student community...pic.twitter.com/xF3w6P19BM,,,,1178671049359024130,https://twitter.com/narendramodi/status/1178671049359024130
2019-09-30 14:00:37,narendramodi,,288,2058,10567,"We live, we learn.pic.twitter.com/f283JqybqH",,,,1178670991033061376,https://twitter.com/narendramodi/status/1178670991033061376
2019-09-30 14:00:26,narendramodi,,381,2144,11673,Foundations of the 21st century will rest on the three crucial pillars of: Innovation. Teamwork. Technology.pic.twitter.com/313zeM8zB4,,,,1178670945768108032,https://twitter.com/narendramodi/status/1178670945768108032
2019-09-30 14:00:07,narendramodi,,369,2303,12614,Students from IITs are: Making Brand India stronger globally. Making India more developed and prosperous.pic.twitter.com/FoGr20Bhf9,,,,1178670863240978433,https://twitter.com/narendramodi/status/1178670863240978433
2019-09-30 13:59:42,narendramodi,,168,1594,7620,"At the @iitmadras convocation, here is how we appreciated the role of the parents and teachers of the graduating students as well as the hardworking support staff of the institutionpic.twitter.com/lZvIJJFeQe",,@iitmadras,,1178670758274273284,https://twitter.com/narendramodi/status/1178670758274273284
2019-09-30 13:44:05,narendramodi,,724,2711,17734,"Devastating news from Banaskantha. I am extremely pained by the loss of lives due to an accident. In this hour of grief, my thoughts are with the bereaved families. The local administration is providing all possible help to the injured. May they recover soon.",,,,1178666831332003840,https://twitter.com/narendramodi/status/1178666831332003840
2019-09-30 13:24:28,narendramodi,,778,3451,19135,We are encouraging innovation and incubation because: We want easy solutions to solve India's problems. And We in India want to find solutions for the whole world. Indian Solutions for Global Application!pic.twitter.com/xrUGqSYiAL,,,,1178661892673294339,https://twitter.com/narendramodi/status/1178661892673294339
2019-09-30 13:24:10,narendramodi,,212,2026,11585,Hackathons are great platforms for youngsters. The solutions from today’s Hackathons are the big ideas for tomorrow’s start-ups.pic.twitter.com/X0gB8YDKkV,,,,1178661816680890369,https://twitter.com/narendramodi/status/1178661816680890369
2019-09-30 13:23:28,narendramodi,,217,1453,7383,From competition to collaboration. Know why this year’s #SingaporeIndiaHackathon is special.pic.twitter.com/XfCrDAJEuA,,,#SingaporeIndiaHackathon,1178661642650865664,https://twitter.com/narendramodi/status/1178661642650865664
2019-09-30 06:35:04,narendramodi,,804,2945,14698,Addressing bright young minds at @iitmadras convocation. Watch.https://www.pscp.tv/w/cGGZmDMyMjExNTJ8MURYeHlwUVpuTlpKTawziEx_0wDiUXnGEfuCsVRkL-JuO22uhj4VQoGns5JN …,,@iitmadras,,1178558865677275136,https://twitter.com/narendramodi/status/1178558865677275136
2019-09-30 04:57:38,narendramodi,,831,3013,15566,Interacting with young innovators at the #SingaporeIndiaHackathon. Watch.https://www.pscp.tv/w/cGGCwjMyMjExNTJ8MWVhS2JBeXdqbm54WFl4_YL07Y2G7Wtqnu-cpW3oO193s25lsvZiQ7ivTAWW …,,,#SingaporeIndiaHackathon,1178534345008566272,https://twitter.com/narendramodi/status/1178534345008566272
2019-09-30 03:51:43,narendramodi,,1235,3932,21686,Speaking at Chennai Airport. Watch.https://www.pscp.tv/w/cGFzTzMyMjExNTJ8MW1yeG1yamx5V3dLeRsPu2AxHG2INJYiVcELRSg60yQTXiLMbIRT73i4C0EZ …,,,,1178517757261824000,https://twitter.com/narendramodi/status/1178517757261824000
2019-09-30 00:46:06,narendramodi,,4441,13185,82680,Other formats mother today parents Navratri worship celibate. Tough austerity fruit receipt to mother Brahmacharini inspiration we provide all the power to fulfill your resolution. Pic.twitter.com/Gai1z9ycfr,,,,1178471043066822656,https://twitter.com/narendramodi/status/1178471043066822656
2019-09-29 16:59:47,narendramodi,,797,2740,17430,"Joined extensive Central Election Committee meetings for elections in Haryana and Maharashtra. We are going to polls in these states based on our development work and double engine of the Centre and State Governments, led by popular as well as industrious Chief Ministers.pic.twitter.com/Xgptm6wg6f",,,,1178353689901187073,https://twitter.com/narendramodi/status/1178353689901187073
2019-09-29 11:23:43,narendramodi,,452,2029,10310,"It does not happen often that the world discusses the runner-up as much as the winner. That is why, when @DaniilMedwed’s speech at the @usopen was widely discussed, I decided to hear it myself and it really touched my heart. #MannKiBaatpic.twitter.com/2BnVqlZXld",,@DaniilMedwed @usopen,#MannKiBaatpic,1178269118761299968,https://twitter.com/narendramodi/status/1178269118761299968
2019-09-29 11:23:07,narendramodi,,370,2056,10873,"During #MannKiBaat, I spoke to the phenomenal Ripudaman Ji, who is improving both fitness and cleanliness levels through his efforts. Have a look…pic.twitter.com/gyTmaJfRKZ",,,#MannKiBaat,1178268965610512384,https://twitter.com/narendramodi/status/1178268965610512384
2019-09-29 11:22:15,narendramodi,,1233,3726,18359,"There is much misinformation about e-cigarettes. They are extremely harmful for health. What is even worse is that unlike tobacco, where the hazards are known, in this case it is silent and equally lethal. #MannKiBaatpic.twitter.com/angfg1k5tq",,,#MannKiBaatpic,1178268747603120128,https://twitter.com/narendramodi/status/1178268747603120128
2019-09-29 11:21:46,narendramodi,,601,3692,20259,"This Diwali, let us salute the indomitable Nari Shakti of India. Let us make this year’s Diwali about #BharatKiLaxmi. To know more, hear this. #MannKiBaatpic.twitter.com/G29eq2YBcx",,,#BharatKiLaxmi #MannKiBaatpic,1178268626949824512,https://twitter.com/narendramodi/status/1178268626949824512
2019-09-29 11:20:58,narendramodi,,359,2081,10479,"Delivery in, delivery out… Here is how you can bring smiles on the faces of several others during this festive season. #MannKiBaatpic.twitter.com/yg036W05xU",,,#MannKiBaatpic,1178268426533404673,https://twitter.com/narendramodi/status/1178268426533404673
2019-09-29 11:19:54,narendramodi,,414,3150,20817,"She is one of the most accomplished and humble Indians. Her popularity spans across generations. Via #MannKiBaat, wished beloved @mangeshkarlata Didi a Happy Birthday and had a memorable interaction with her.pic.twitter.com/pjiNGk6lQ0",,@mangeshkarlata,#MannKiBaat,1178268157649154049,https://twitter.com/narendramodi/status/1178268157649154049
2019-09-29 05:30:24,narendramodi,,1033,3101,14562,Tune-in to this month’s #MannKiBaat.https://www.pscp.tv/w/cGA48DMyMjExNTJ8MUJkeFllTFpPTkJ4WIMvqKggjppo49zKIpxHnqmcmLa--EOaGqDN6b-hJ4CX …,,,#MannKiBaat,1178180201684979712,https://twitter.com/narendramodi/status/1178180201684979712
2019-09-29 05:12:42,narendramodi,PMOIndia,625,2486,17808,I have a very special guest joining us today during #MannKiBaat. Do tune in at 11 AM.https://twitter.com/PMOIndia/status/1178173368627019776 …,,,#MannKiBaat,1178175747673837568,https://twitter.com/narendramodi/status/1178175747673837568
2019-09-29 04:19:08,narendramodi,HRDMinistry,328,2090,11946,A great mix of youth power and innovation! The #SingaporeIndiaHackathon brings together the finest young minds finding long lasting solutions to the problems we face. Will take part in the prize distribution ceremony of this Hackathon in Chennai tomorrow.https://twitter.com/HRDMinistry/status/1177579730205151237 …,,,#SingaporeIndiaHackathon,1178162268711710720,https://twitter.com/narendramodi/status/1178162268711710720
2019-09-29 03:56:38,narendramodi,,1529,4184,31811,"Tomorrow I would be in Chennai for the convocation ceremony of @iitmadras. I look forward to being with some of India’s brightest minds. I also call upon all of you, especially IITians and IIT alumni to share their ideas for my speech. Do so on the Open Forum on the NaMo App.",,@iitmadras,,1178156605113634825,https://twitter.com/narendramodi/status/1178156605113634825
2019-09-29 02:04:23,narendramodi,,3474,11067,61090,"# Before Navratri day we worship first as mother shailaputree the goddess Durga and worship. Welfare of power and peace symbols mother shailaputree entire world, but wished. Pic.twitter.com/FW7Q28LIZn",,,#नवर,1178128358351048704,https://twitter.com/narendramodi/status/1178128358351048704
2019-09-29 02:02:28,narendramodi,,8740,14916,100022,"All citizens very happy to # Navratri. Jai Mata Di! All have the power of the holy festival Navaratri worship Congratulations to. Durga us new energy in everyone's life, new enthusiasm and bring a renewed vigor. Jai Ambe Jagdnbe mother!",,,#नवर,1178127872696827904,https://twitter.com/narendramodi/status/1178127872696827904
2019-09-28 15:13:20,narendramodi,,3423,7583,40236,A memorable welcome in Delhi. Watch.https://www.pscp.tv/w/cF9wEDMyMjExNTJ8MVlwS2tZYWthcVZKasrIfYplXLR9qK3GbGLu68kC81n20FiWlb0KZAJ2do18 …,,,,1177964513087221760,https://twitter.com/narendramodi/status/1177964513087221760
2019-09-28 06:23:20,narendramodi,,1869,6634,48584,Shubho Mahalaya! We pray for the abundance of happiness in our lives. May everyone be healthy and prosperous. May the blessings of Maa Durga always remain on our society.,,,,1177831135977623553,https://twitter.com/narendramodi/status/1177831135977623553
2019-09-28 04:49:50,narendramodi,,808,3541,24970,"Celebrating the power of 130 crore Indians, igniting a spirit of positivity across our nation. Do tune in to another episode of #MannKiBaat tomorrow at 11 AM.pic.twitter.com/w6LRMRlsaO",,,#MannKiBaat,1177807606662012928,https://twitter.com/narendramodi/status/1177807606662012928
2019-09-28 04:48:24,narendramodi,,1769,9735,54182,Shaheed #BhagatSingh’s name is synonymous with valour and sacrifice. His courageous actions continue to motivate millions. He remains among the most popular icons in the minds of the youth. I bow to this great son of Mother India on his Jayanti.,,,#BhagatSingh,1177807247226880000,https://twitter.com/narendramodi/status/1177807247226880000
2019-09-27 19:28:50,narendramodi,,218,1909,11141,"I would like to express gratitude to the people of USA for the exceptional welcome, warmth and hospitality. I would also like to thank @POTUS @realDonaldTrump and other respected Members of the American Congress and Government.",,@POTUS @realDonaldTrump,,1177666426812977152,https://twitter.com/narendramodi/status/1177666426812977152
2019-09-27 19:28:43,narendramodi,,193,2162,13697,"Wherever I went, whoever I met, be it world leaders, industrialists or citizens from all walks of life, there is a great spirit of optimism towards India. There is also immense appreciation of India’s efforts to improve sanitation, healthcare and empower the poor.",,,,1177666396521664512,https://twitter.com/narendramodi/status/1177666396521664512
2019-09-27 19:28:34,narendramodi,,50,768,4223,"Community connect is at the heart of India-USA relations. I will never forget the #HowdyModi programme, made more special by the coming of @POTUS. That gesture showed how much he personally, and USA values ties with India as well as the role of our talented diaspora.",,@POTUS,#HowdyModi,1177666357690880001,https://twitter.com/narendramodi/status/1177666357690880001
2019-09-27 19:28:32,narendramodi,,39,564,2117,Drawing more investment to India and acquainting the world with India’s reform trajectory was one of the aims too. My interactions with energy sector CEOs in Houston and American captains of industry in NY were successful. The world is eager to explore opportunities in India.,,,,1177666350208167938,https://twitter.com/narendramodi/status/1177666350208167938
2019-09-27 19:28:29,narendramodi,,53,621,2340,"From the @UN forum, I shared views on India’s progress in healthcare, mitigating climate change and the need for all those who believe in humanity to come together to fight terror. India was honoured to host a special event marking the 150th birth anniversary of Mahatma Gandhi.",,@UN,,1177666338006982660,https://twitter.com/narendramodi/status/1177666338006982660
2019-09-27 19:28:25,narendramodi,,86,779,2995,"At the @UN, I shared my thoughts on how India’s development strides have transformed the landscape of our nation and how India will keep working towards making our planet more peaceful, prosperous and harmonious. I also had excellent bilateral meetings with fellow world leaders.",,@UN,,1177666319895928834,https://twitter.com/narendramodi/status/1177666319895928834
2019-09-27 19:28:21,narendramodi,,763,3662,24229,"This USA visit was an extremely productive one. Over the last few days, I have been able to take part in a diverse range of programmes, the outcomes of which will greatly benefit India and our development trajectory.",,,,1177666302179184640,https://twitter.com/narendramodi/status/1177666302179184640
2019-09-27 19:21:03,narendramodi,,431,3575,26675,I thank my sisters and brothers of Badharghat in Tripura and Hamirpur in UP for placing their faith in @BJP4India. We will always remain at the forefront of fulfilling their dreams. I salute the respective state units and Karyakartas who worked hard among the people.,,@BJP4India,,1177664467074768903,https://twitter.com/narendramodi/status/1177664467074768903
2019-09-27 19:19:54,narendramodi,,215,1661,9503,"Had the opportunity to interact with the PM of Greece, @kmitsotakis. India-Greece relations have stood the test of time. We will work to enhance trade as well as people-to-people relations for the benefit of our citizens.pic.twitter.com/KD6VkPrDRQ",,@kmitsotakis,,1177664176552067072,https://twitter.com/narendramodi/status/1177664176552067072
2019-09-27 19:16:30,narendramodi,MauritiusPM,192,2043,15022,"My friend, @MauritiusPM, I was delighted to meet President Paramasivum Pillay Vyapoory. We had a good interaction on ways to diversify India-Mauritius friendship.https://twitter.com/MauritiusPM/status/1177621204045307911 …",,@MauritiusPM,,1177663323627773952,https://twitter.com/narendramodi/status/1177663323627773952
2019-09-27 19:16:00,narendramodi,,172,1574,10411,"It is always wonderful to meet my friend, @PMBhutan. We reviewed the ground covered so far in furthering India-Bhutan friendship. We discussed ways to boost bilateral cooperation.pic.twitter.com/4zIHsB7cVc",,@PMBhutan,,1177663194946527232,https://twitter.com/narendramodi/status/1177663194946527232
2019-09-27 19:14:41,narendramodi,,131,1056,6405,དུས་ནམ་རང་འབད་རུང་ ངེ་ཆ་རོགས་ @PMBhutan དང་མཇལ་ནི་འདི་ དགའ་སྤྲོ་ཆེ་རང་ཆེ་བས། ང་བཅས་གཉིས་ཀྱིས་ རྒྱ་འབྲུག་མཐུན་ལམ་གྱི་ལས་སྣ་ཚུ་གི་སྐོར་ལས་ བསྐྱར་ཞིབ་འབད་ཡི། ང་བཅས་གཉིས་ཀྱིས་ ཟུང་ཕྱོགས་མཐུན་འབྲེལ་གོང་འཕེལ་བཏང་ནི་གིས་ ཐབས་ཤེས་ཚུ་ཡང་བསྟུན་གྲོས་འབད་ཡི།pic.twitter.com/Oo5Gdn3eRi,,@PMBhutan,,1177662864670314496,https://twitter.com/narendramodi/status/1177662864670314496
2019-09-27 19:12:49,narendramodi,,222,1575,10275,"Excellent meeting with PM Sheikh Hasina. We talked about a wide range of subjects, particularly how to deepen economic as well as people-to-people cooperation between our nations.pic.twitter.com/iPBJC41ZRa",,,,1177662393058578433,https://twitter.com/narendramodi/status/1177662393058578433
2019-09-27 19:11:37,narendramodi,,298,1495,10148,"Nice meeting with Prime Minister Sheikh Hasina. We have discussed in detail various issues, especially how our two countries can deepen economic cooperation and people-to-people contacts also pic.twitter.com/afd0mBqk49",,,,1177662094340247552,https://twitter.com/narendramodi/status/1177662094340247552
2019-09-27 18:06:53,narendramodi,,797,4573,24324,"The world's largest democracy, is still the same message to the international community, which Swami Vivekananda had years ago - goodwill and peace. Pic.twitter.com/yVWTKiQYpL",,,,1177645803864760321,https://twitter.com/narendramodi/status/1177645803864760321
2019-09-27 18:06:36,narendramodi,,2835,10395,60839,"We lived in the country, which has not Buddha war the world has a message of peace. Pic.twitter.com/tVTy7gyvX7",,,,1177645730036699136,https://twitter.com/narendramodi/status/1177645730036699136
2019-09-27 18:06:11,narendramodi,,277,2521,11409,"If we are to look at Per Capita Emissions, India’s role in furthering global warming has always been historically low. Yet, we have taken the lead when it comes to harnessing renewable resources. India is also at the forefront of building consensus on disaster management.pic.twitter.com/Bemek6kUyL",,,,1177645626005295104,https://twitter.com/narendramodi/status/1177645626005295104
2019-09-27 18:05:35,narendramodi,,657,3175,15199,"Our Pranttw that welfare of participation and these are not just, Jagkalyan India. If our motivation is all together, all development, trust everyone. It is not confined to the borders of India. Our work is not found mercy, nor pretend. These are just motivated by a sense of duty. Pic.twitter.com/1b928gnwmP",,,,1177645475836694528,https://twitter.com/narendramodi/status/1177645475836694528
2019-09-27 18:05:18,narendramodi,,1739,7078,40104,"This year was the largest election in the world. The world's largest democracy, voted by most people in the world, gave me and much stronger mandate from my government. This mandate again today I am in the UN. But out of this mandate a message larger, comprehensive and persuasive. Pic.twitter.com/IJSyMvStRB",,,,1177645403556253696,https://twitter.com/narendramodi/status/1177645403556253696
2019-09-27 14:03:46,narendramodi,,3163,10541,39238,Addressing the @UN General Assembly. Watch.https://www.pscp.tv/w/cF4OQjMyMjExNTJ8MVJEeGxOYlFXUk9HTDpr2fYy6xdhJp7TVi8-hDA2Dd5xk0CEyWTbMDwmAXnv …,,@UN,,1177584620214243328,https://twitter.com/narendramodi/status/1177584620214243328
2019-09-26 23:58:51,narendramodi,,715,3279,24440,"Had a productive meeting with President @AnastasiadesCY. We discussed the full gamut of issues pertaining to India-Cyprus friendship. This includes boosting commercial, cultural and technological linkages.pic.twitter.com/CcwaXM4MpJ",,@AnastasiadesCY,,1177371989541097478,https://twitter.com/narendramodi/status/1177371989541097478
2019-09-26 19:45:46,narendramodi,,399,2229,20029,I was very pleased to meet with President HassanRouhani @. We have a wide range of issues related to India-Iran relations discussed in detail pic.twitter.com/dELmdiDEGz,,@بسیار,,1177308300628713473,https://twitter.com/narendramodi/status/1177308300628713473
2019-09-26 19:45:19,narendramodi,,400,2370,18472,"Delighted to meet President @HassanRouhani. We had in-depth discussions on the full range of India-Iran ties, and regional & global matterspic.twitter.com/Z5uwZPW7LD",,@HassanRouhani,,1177308185444716546,https://twitter.com/narendramodi/status/1177308185444716546
2019-09-26 19:44:25,narendramodi,,808,4019,35965,"My deepest condolences on passing away of Jacques Chirac. India mourns the loss of a true global statesman. A friend of India, he played a decisive role in establishing and building India-France Strategic Partnership.",,,,1177307959199698945,https://twitter.com/narendramodi/status/1177307959199698945
2019-09-26 04:49:38,narendramodi,,622,2480,12817,Had a great interaction with leading American CEOs. Here are highlights from the meeting. http://nm-4.com/n6w8 via NaMo Apppic.twitter.com/JgMVuxzGMk,,,,1177082779764514822,https://twitter.com/narendramodi/status/1177082779764514822
2019-09-26 04:48:14,narendramodi,,439,2959,19467,The India-Caricom Leaders' Meeting held in New York was an important occasion for us. I thank the esteemed world leaders who joined the meeting. India is eager to work with our friends in the Caribbean to build a better planet.pic.twitter.com/Qvrc1EJwS1,,,,1177082428453773312,https://twitter.com/narendramodi/status/1177082428453773312
2019-09-26 04:45:09,narendramodi,,313,2403,16045,"Had an excellent meeting with PM @jacindaardern. Her presence at the event hosted by India at the @UN was a great gesture too. During our talks today we reviewed the full range of ties between India and New Zealand, which would benefit our citizens.pic.twitter.com/zCcSYCTund",,@jacindaardern @UN,,1177081652130066433,https://twitter.com/narendramodi/status/1177081652130066433
2019-09-26 04:43:58,narendramodi,,265,2052,11595,"Held extensive deliberations with PM @NikolPashinyan. We talked about expanding India-Armenia cooperation in aspects relating to technology, pharmaceuticals and agro-based industries. PM Pashinyan also referred to the popularity of Indian movies, music and Yoga in Armenia.pic.twitter.com/CJ5By5ROXA",,@NikolPashinyan,,1177081353487228929,https://twitter.com/narendramodi/status/1177081353487228929
