date,username,to,replies,retweets,favorites,text,geo,mentions,hashtags,id,permalink
2018-03-07 18:00:40,atiku,ClassicalZD,50,83,279,"Dear ZD, I’m excited by Nollywood’s growth. Purchasing power to watch Nollywood films is a huge problem. If we increase Nigerians’ purchasing power, more cinemas will open, more people will watch films, so Nollywood budgets increase.https://twitter.com/classicalzd/status/971051002953691138 …",,,,971445543464562689,https://twitter.com/atiku/status/971445543464562689
2018-03-05 20:47:47,atiku,,202,391,1689,"A very happy 81st birthday to you, former President Obasanjo. Our country has been blessed with your statemanship over these many decades. Many happy returns.",,,,970762824153812993,https://twitter.com/atiku/status/970762824153812993
2018-03-05 16:13:27,atiku,,105,299,700,"Black Panther — A good film with many lessons for Nigeria https://medium.com/@atiku/black-panther-a-good-film-with-many-lessons-for-nigeria-448d952c56b …pic.twitter.com/H84edxyDxB",,@atiku,,970693782692917250,https://twitter.com/atiku/status/970693782692917250
2018-03-05 16:08:02,atiku,,172,352,920,"I just published “Black Panther — A good film with many lessons for Nigeria”https://medium.com/p/black-panther-a-good-film-with-many-lessons-for-nigeria-448d952c56b …",,,,970692422446534657,https://twitter.com/atiku/status/970692422446534657
2018-03-05 07:01:12,atiku,,86,240,417,"It breaks my heart that the Mambilla has lost its serenity to violence and avoidable deaths. It is important that we bring culprits to justice else others will be emboldened to thread the same path as the resurgence of violence in Mambilla has shown.https://www.premiumtimesng.com/news/headlines/260665-mambilla-20-reported-killed-300-cows-stolen-fresh-taraba-violence.html …",,,,970554804455034880,https://twitter.com/atiku/status/970554804455034880
2018-03-04 10:46:19,atiku,,40,184,521,"I am excited to read the news about our own dear @iread_bayode. He has not only set a new Guinness World Record in the 'Longest Marathon Reading Aloud' category, but he has also brought attention to reading, an important building block of education.https://www.vanguardngr.com/2018/03/nigerian-bayode-breaks-guinness-record-longest-marathon-reading-aloud/ …",,@iread_bayode,,970249071792394240,https://twitter.com/atiku/status/970249071792394240
2018-03-04 08:20:57,atiku,,795,1562,4985,"I saw #BlackPanther with my children and some of their friends yesterday. It is a very good movie and I encourage everyone to go and see it.",,,#BlackPanther,970212486799593473,https://twitter.com/atiku/status/970212486799593473
2018-03-02 18:44:42,atiku,,17,67,160,"Even as I convey my deepest sympathy to the families and loved ones of the victims, I am gladdened by the commitment of the institutions in standing with us at this most challenging time.",,,,969644685902958594,https://twitter.com/atiku/status/969644685902958594
2018-03-02 18:44:41,atiku,,84,232,613,"I am sad to hear about the death of aid workers killed in the overnight attacks in Rann, Borno State. Everyday, aid workers sacrifice their comfort in other to care for the most vulnerable in our society. The least we can do is spare their lives.http://europa.eu/rapid/press-release_STATEMENT-18-1502_en.htm …",,,,969644681628921856,https://twitter.com/atiku/status/969644681628921856
2018-02-27 18:45:28,atiku,,74,181,413,"The crisis in Kaduna is condemnable. But prompt arrest and diligent prosecution of criminal elements fomenting trouble in our communities will give confidence to Nigerians and discourage those who may want to thread the path of criminality.https://www.premiumtimesng.com/regional/nwest/259996-seven-killed-kaduna-violence.html …",,,,968557713516126210,https://twitter.com/atiku/status/968557713516126210
2018-02-25 11:37:52,atiku,,118,417,1558,"I'm proud of the legacy of Seun Adigun, Akuoma Omeoga, Ngozi Onwumere and Simi Adeagbo at #PyeongChang2018. They have won our hearts and are an inspiration to all who dare to conquer new frontiers. #ClosingCeremonypic.twitter.com/1bwQC5u0FU",,,#PyeongChang2018 #ClosingCeremonypic,967725330000642048,https://twitter.com/atiku/status/967725330000642048
2018-02-24 16:08:14,atiku,,54,88,220,"It was also great to see entrepreneurs who have built businesses and created jobs honoured. I agree with Dr. Leo Stan Ekeh that our country's young entrepreneurs need a lifting up.",,,,967430980385591296,https://twitter.com/atiku/status/967430980385591296
2018-02-24 16:06:55,atiku,,35,107,279,"I’m also very impressed with the life-saving interventions of Dr. Ola Orekunrin-Brown in Nigeria and other places in Africa. Her passion and energy is a shinning example of what the youth of Nigeria can achieve with determination.pic.twitter.com/5MIksA6bOA",,,,967430648574234625,https://twitter.com/atiku/status/967430648574234625
2018-02-24 16:02:25,atiku,,213,305,1229,"Great seeing Gov Wike last night and discussing the great stuff he is doing in Rivers State. He is building the foundation of prosperity for not just the people of Rivers State, but for Nigerians who believe in good governance. His #SilverbirdManOfTheYear award is well deserved.pic.twitter.com/ttS0xO7a4z",,,#SilverbirdManOfTheYear,967429517420752896,https://twitter.com/atiku/status/967429517420752896
2018-02-23 22:12:40,atiku,,60,83,306,"Thank you ladies and gentlemen and may God bless Nigeria!",,,,967160307310317568,https://twitter.com/atiku/status/967160307310317568
2018-02-23 22:11:35,atiku,,64,184,392,"A few days ago, a group of girls were taken from Government Girls Secondary School, Dapchi, in Yobe State. Can we say a silent prayer for a minute for the safe return of the #DapchiGirls?",,,#DapchiGirls,967160031388094464,https://twitter.com/atiku/status/967160031388094464
2018-02-23 22:09:29,atiku,,50,232,342,"We must accept that the difference between Nigerians is not North and South, Christian and Muslim or PDP and APC. The difference is between good and bad people and we must demonstrate that the good are much more than the bad.",,,,967159503232929792,https://twitter.com/atiku/status/967159503232929792
2018-02-23 22:07:49,atiku,,149,473,573,"Our elite are treated in Europe. #BBNaija is being broadcast from South Africa and @Nike is unveiling our FIFA World Cup Jersey in London. Is this the extent to which we have outsourced Nigeria?",,@Nike,#BBNaija,967159084465229824,https://twitter.com/atiku/status/967159084465229824
2018-02-23 22:06:33,atiku,,75,218,314,"We have to enact laws to prevent leaders from diverting public funds from the public health sector to the treatment of the elite in the best hospitals abroad. If you can afford it from your own private resources, then pay for it. But do not make the tax payer pay for it.",,,,967158767245840386,https://twitter.com/atiku/status/967158767245840386
2018-02-23 22:05:49,atiku,,21,168,163,"We cannot spend 70% of our budget on recurrent expenditure at a time Nigeria has more unemployed or underemployed people than the entire population of the Republic of Cameroon.",,,,967158581199081472,https://twitter.com/atiku/status/967158581199081472
2018-02-23 22:05:30,atiku,,29,133,150,"When I was in government, we reduced recurrent expenditure by introducing the monetization Policy and by privatizing many government enterprises. Today, those policies have been abandoned and recurrent expenditures have ballooned.",,,,967158501054271489,https://twitter.com/atiku/status/967158501054271489
2018-02-23 22:02:44,atiku,,38,215,216,"Nigeria needs to be restructured. We must embrace restructuring as something that must be done to fix Nigeria’s broken systems and not just a campaign gimmick that we fish out of our magic hats and deny after we have gotten what we want.",,,,967157806934740993,https://twitter.com/atiku/status/967157806934740993
2018-02-23 22:01:29,atiku,,65,217,262,"We have to kill the snake of corruption that swallows the commonwealth that should lift our people up from poverty. Whether that snake is in a JAMB Office or any other government office, we must kill it or it will kill us.",,,,967157493217550336,https://twitter.com/atiku/status/967157493217550336
2018-02-23 22:00:50,atiku,,18,172,170,"We talk of fighting corruption, but let us move beyond sentiments and media trials and look at the facts. We must try to identify why, though we have been ostensibly fighting corruption for the past few years, Transparency International is scoring Nigeria even lower than in 2014",,,,967157326825381889,https://twitter.com/atiku/status/967157326825381889
2018-02-23 21:58:30,atiku,,18,147,181,"Nigeria has a median age of 18.3 years. Our population is young. So when we have successful and laudable initiatives like YouWIN, we must continue them even when there has been a change in administration.",,,,967156739983495168,https://twitter.com/atiku/status/967156739983495168
2018-02-23 21:58:13,atiku,,28,169,219,"When people do not have jobs and the means to start a business are beyond their reach, they are incrementally much more likely to engage in criminal behaviours like terrorism, kidnapping, militancy and armed robbery.",,,,967156670932684801,https://twitter.com/atiku/status/967156670932684801
2018-02-23 21:57:29,atiku,,95,388,210,"This month, according to the World Poverty Clock, Nigeria has just overtaken India as the world's capital of extreme poverty. There are more extremely poor people in Nigeria than there are in India, a country that has six times Nigeria's population.",,,,967156485196320768,https://twitter.com/atiku/status/967156485196320768
2018-02-23 21:56:56,atiku,,17,64,124,"After contracting for five consecutive quarters, Nigeria came out of recession in the second quarter of 2017 with a GDP growth rate of 0.55%. In the third quarter, we fared better with 1.40%",,,,967156347480477696,https://twitter.com/atiku/status/967156347480477696
2018-02-23 21:56:06,atiku,,32,133,219,"Nigeria is caught in a modern-day Malthusian Trap. For years, our population has been growing faster than our Gross Domestic Product (GDP). Our increasing population drives competition for resources that are not keeping pace with population growth.pic.twitter.com/uyvrEn7lUU",,,,967156137383677953,https://twitter.com/atiku/status/967156137383677953
2018-02-23 21:53:33,atiku,,25,112,147,"#Keynote Our nation is going through a lot of challenges. There are challenges to our unity, economy. Most worrisome are the security challenges we are currently facing. These challenges are actually symptoms. They are not the ailment.",,,#Keynote,967155492891054083,https://twitter.com/atiku/status/967155492891054083
2018-02-23 21:52:49,atiku,,227,576,1649,"A minute of silence for Nigerians who lost their lives in Adamawa, Benue, Taraba, Zamfara etc.",,,,967155310715654144,https://twitter.com/atiku/status/967155310715654144
2018-02-23 20:53:52,atiku,,38,112,393,"I was honored to present Chief MKO Abiola’s Silverbird posthumous award to his daughter and grandchildren. #SilverbirdManoftheYearpic.twitter.com/9SBffIZePH",,,#SilverbirdManoftheYearpic,967140475701485569,https://twitter.com/atiku/status/967140475701485569
2018-02-23 20:32:45,atiku,,132,239,888,"At the #SilverbirdManoftheYear Awards with Governor Nyesom Wike and Senator @benmurraybrucepic.twitter.com/ai3vocdJA9",,@benmurraybrucepic,#SilverbirdManoftheYear,967135161707126785,https://twitter.com/atiku/status/967135161707126785
2018-02-22 18:16:34,atiku,,137,464,1080,"My heart and prayers are with the #DapchiGirls who are missing and their families. Let's give our unconditional support to them and to the agencies and security forces who are working to find them. There is nothing that should unify us more than the safe return of these children.",,,#DapchiGirls,966738499339739137,https://twitter.com/atiku/status/966738499339739137
2018-02-20 09:50:29,atiku,,120,285,676,"What a relief it was for me to learn that the schoolgirls and teachers of GSS Dapchi in Yobe State are safe. However, we must be vigilant.http://www.bbc.co.uk/news/world-africa-43122095 …",,,,965886366046408704,https://twitter.com/atiku/status/965886366046408704
2018-02-19 16:02:37,atiku,,125,278,903,"I sympathize with the management and fans of Kano Pillars on the the sudden death of Chinedu Udoji. I also sympathize with his family and friends over the sad loss and pray that his soul finds a gentle repose.https://punchng.com/kano-pillars-defender-udoji-dies-in-auto-crash/ …",,,,965617627933675520,https://twitter.com/atiku/status/965617627933675520
2018-02-18 10:23:47,atiku,,61,139,464,"A teacher, a philosopher and nationalist - Professor Akinwunmi used arts to preach against societal ills. He will be missed. May his soul Rest In Peace.https://www.premiumtimesng.com/entertainment/artsbooks/259036-culture-icon-akinwunmi-ishola-dead.html …",,,,965169969410473985,https://twitter.com/atiku/status/965169969410473985
2018-02-17 19:30:10,atiku,,60,185,874,"I’m particularly proud of you Simidele Adeagbo - most especially, your bold move that saw you become Africa’s first ever female Olympic skeleton athlete. Keep the spirit. Greater outcomes are ahead of you. #PyeongChang2018",,,#PyeongChang2018,964945082771296258,https://twitter.com/atiku/status/964945082771296258
2018-02-17 18:03:04,atiku,,82,182,412,"My prayers and thoughts are with the families and friends of all those who may have lost a dear one in the suicide bomb attacks in Borno. It is my fervent hope that the injured will get the medical attention they deserve.https://www.premiumtimesng.com/news/headlines/258989-18-killed-borno-suicide-bomb-attacks.html …",,,,964923164873682944,https://twitter.com/atiku/status/964923164873682944
2018-02-15 20:29:15,atiku,,64,168,692,"Onitemi Alhaji Abdulazeez Arisekola Alao, I remember you today on your 72nd posthumous birthday with fond memories of your very simple disposition to life and the zest with which you put smiles on the faces of people. Continue to Rest In Peace my dear friend.pic.twitter.com/yoSuHg03Dm",,,,964235178100084737,https://twitter.com/atiku/status/964235178100084737
2018-02-15 14:14:07,atiku,,103,223,665,"Smooth transitions such as we have had in Nigeria in 2015, in Liberia only recently and today in South Africa with the swearing in of @CyrilRamaphosa as President is germane to deepening democracy in the continent.",,@CyrilRamaphosa,,964140770314850306,https://twitter.com/atiku/status/964140770314850306
2018-02-14 08:06:11,atiku,,41,84,219,"It was a great discussion and look forward to working with IRI to enhance democratic governance in Nigeria, strengthen our democratic institutions and help remove the obstacles that keep the youth and other underrepresented groups from helping govern our nation.",,,,963685789753364480,https://twitter.com/atiku/status/963685789753364480
2018-02-14 08:06:10,atiku,,104,144,478,"I received the delegation from @IRIGlobal; Pres. @DCTwining, @IRI_Africa’s Regional Director @tomozeus and In-Country Director for Nigeria @sentellbarnes.pic.twitter.com/TWF7karfeB",,@IRIGlobal @DCTwining @IRI_Africa @tomozeus @sentellbarnes,,963685784946606080,https://twitter.com/atiku/status/963685784946606080
2018-02-13 19:00:06,atiku,,144,230,487,"That we lost 22 students in a road carnage is so saddening and very regrettable. I condole with parents and guardians of these pupils. May God accept these young souls and heal the hearts of the bereaved families and friends. Ameen.https://www.premiumtimesng.com/news/headlines/258527-just-bus-crash-claims-22-secondary-school-students.html …",,,,963487967011639301,https://twitter.com/atiku/status/963487967011639301
2018-02-12 19:18:37,atiku,,57,103,314,"The late Brig. Gen. John Shagaya was a fine military officer, a democrat and a statesman. His many contributions both in uniform and in the senate have enriched our quest for a safer country and expanded our conversation about building a virile democracy. May he rest.pic.twitter.com/0YJb8uB0yV",,,,963130237054865408,https://twitter.com/atiku/status/963130237054865408
2018-02-12 14:02:36,atiku,,102,232,729,"A delegation of Arewa Youth Leadership Initiative paid a courtesy visit yesterday. I'm honoured to stand with them on the campaign for a drug-free society.pic.twitter.com/fTmrF82FWT",,,,963050710366552066,https://twitter.com/atiku/status/963050710366552066
2018-02-12 06:00:25,atiku,,19,58,151,"I wish to commend all the Nigerian agencies that worked with the ICRC in the negotiations leading to their release and urge them to show even greater commitment to work towards the release of all those still held in captivity.https://www.premiumtimesng.com/news/headlines/258227-boko-haram-releases-university-lecturers-policewomen.html …",,,,962929363594498048,https://twitter.com/atiku/status/962929363594498048
2018-02-12 06:00:24,atiku,,117,220,793,"The news of the release of the UNIMAID lecturers and policewomen is cheering. It also rekindles hope of the release of all those still in captivity.",,,,962929359807045633,https://twitter.com/atiku/status/962929359807045633
2018-02-11 08:00:19,atiku,,41,133,350,"Their efforts pave the way for our girls to test the bounds of imagination and help bring solutions to the world’s greatest scientific challenges. Let’s do our part to encourage them.pic.twitter.com/NeukhhO41E",,,,962597150596182016,https://twitter.com/atiku/status/962597150596182016
2018-02-11 08:00:14,atiku,,125,257,910,"Today is International Day of Women and Girls in Science. Our own Prof Grace Alele-Williams pioneered a generation of our country’s women like Francisca Nnena Okeke, Deborah Ajakaiye and Rabia Sa’id to be leaders in science. #WomenInScience",,,#WomenInScience,962597128962002945,https://twitter.com/atiku/status/962597128962002945
2018-02-10 08:10:17,atiku,,149,268,1068,"On behalf of the Abubakar family, I commiserate with @NGRPresident @MBuhari over the passing on of his sister in-law, Hajiya Aisha Mamman. May Allah grant her Aljannah Firdaus, and grant the Danbaffale Mamman family in Daura the fortitude to bear the loss. Ameen.",,@NGRPresident @MBuhari,,962237272581181440,https://twitter.com/atiku/status/962237272581181440
2018-02-10 08:03:34,atiku,,117,283,841,"Malam Yusuf Buratai, a World War II Veteran and father of COAS Lt. Gen. Tukur Buratai will be remembered for his services to keep country and the world safe and united. May Allah grant him Aljannah Firdaus. Ameen.pic.twitter.com/lTBbZKMrY5",,,,962235579386777605,https://twitter.com/atiku/status/962235579386777605
2018-02-09 08:01:16,atiku,,38,123,363,"For years, I have identified with the amazing work of Mrs. Itoro Eze-Anaba and her team @MirabelCentreNG. Congratulations, and I am so proud of what you have accomplished.https://www.google.com.ng/amp/s/punchng.com/queen-elizabeth-honours-anti-rape-activist-itoro-eze-anaba/amp/ …",,@MirabelCentreNG,,961872614141542400,https://twitter.com/atiku/status/961872614141542400
2018-02-08 08:00:08,atiku,,87,293,1093,"What we lack in snow, the quartet of Ngozi Onwumere, Akuoma Omeoga, Seun Adigun and Simi Adeagbo embody in the indomitable spirit of Nigeria to conquer new grounds. #PyeongChang2018pic.twitter.com/Jrrw9iJbMI",,,#PyeongChang2018pic,961509941482844161,https://twitter.com/atiku/status/961509941482844161
2018-02-04 21:08:07,atiku,,145,288,1334,"Sad loss for all of us. You fought bravely. Thanks for bringing Nigeria all the way to the finals @NGSuperEagles",,@NGSuperEagles,,960258693077127171,https://twitter.com/atiku/status/960258693077127171
2018-02-04 19:41:56,atiku,,226,332,1513,"I am ready and trust that you are too to give @NGSuperEagles our unflinching support. #TotalCHAN2018 #MARNGApic.twitter.com/I0KvFV4HGm",,@NGSuperEagles,#TotalCHAN2018 #MARNGApic,960237001017643008,https://twitter.com/atiku/status/960237001017643008
2018-02-03 18:44:59,atiku,Dj_Abba,158,477,998,"It was an opportune moment to host @Dj_Abba today. We had a robust conversation and I’m convinced more that the youth of Nigeria are smart and promising.https://twitter.com/dj_abba/status/959844150391787520 …",,@Dj_Abba,,959860284633600001,https://twitter.com/atiku/status/959860284633600001
2018-01-31 21:47:53,atiku,,113,356,1228,"Happy that against all odds, our @NGSuperEagles have made it to the finals #CHAN2018. We can learn from their success - proof of what can happen when we are united, focused and committed.",,@NGSuperEagles,#CHAN2018,958819148863361024,https://twitter.com/atiku/status/958819148863361024
2018-01-31 20:04:59,atiku,,91,194,920,"Sad that @NGSuperEagles has lost her goalkeeper, Ikechukwu Ezenwa early in the game but glad we didn’t lose the initiative, as we are now in the lead.",,@NGSuperEagles,,958793253888851968,https://twitter.com/atiku/status/958793253888851968
2018-01-31 17:32:40,atiku,,118,285,913,"It was a memorable experience hearing people reflect on the life of late Dr. Alex Ekwueme today in Enugu. He was a great man, great thinker, great achiever and one of our most committed democrats. His vision, guidance, and fortitude for a better Nigeria will be greatly missed.pic.twitter.com/dakc52928y",,,,958754919019876352,https://twitter.com/atiku/status/958754919019876352
2018-01-29 08:31:04,atiku,,128,290,1165,"Thank you @NGSuperEagles for this sweet victory. Proof that Nigeria wins big when we all stand united. #CHAN2018",,@NGSuperEagles,#CHAN2018,957893848226820096,https://twitter.com/atiku/status/957893848226820096
2018-01-28 20:25:42,atiku,,93,385,1143,"It was inspiring to hear tonight's tributes to Dr. Alex Ekwueme, a statesman who mobilized Nigerians to return the country to democracy. He was a strong, fair voice for truth and justice at all times. Adieu Ide!pic.twitter.com/k4yE1B7nMk",,,,957711304088793089,https://twitter.com/atiku/status/957711304088793089
2018-01-25 20:08:22,atiku,,89,141,447,"It was a delight having a conversation with Paul Lehman and other officials of @AusHCAbuja yesterday. I share their enthusiasm on and what can be accomplished by our two countries working together.pic.twitter.com/aXpNKoCUHz",,@AusHCAbuja,,956619775395991552,https://twitter.com/atiku/status/956619775395991552
2018-01-25 17:28:48,atiku,,256,443,1552,"Thank you @GovAyoFayose for the warm reception in Ekiti. Great hearing about the impressive things happening in your state. Thank you Ekitikete.pic.twitter.com/3FBHz0Nqjs",,@GovAyoFayose,,956579619951562771,https://twitter.com/atiku/status/956579619951562771
2018-01-25 14:40:24,atiku,,27,413,357,"We all have a role to play to fight Lassa fever. Please share this image with all family and friends.pic.twitter.com/ozpJQbO2X0",,,,956537240913661952,https://twitter.com/atiku/status/956537240913661952
2018-01-25 14:38:39,atiku,,25,192,348,"Our health workers who are in the front line of this response are deserving of our support and recognition. With your determination and our united support, I believe that Nigeria will overcome the outbreak of Lassa fever.",,,,956536801325387776,https://twitter.com/atiku/status/956536801325387776
2018-01-25 14:36:39,atiku,,299,1177,2340,"Let’s all take a moment to honour the sacrifices of Dr. Abel Sunday Udo, Dr. Ali Felix and Dr. Idowu Ahmed who were infected and died in the course of treating Lassa fever patients in Ebonyi and Kogi, among other health workers.",,,,956536296142450688,https://twitter.com/atiku/status/956536296142450688
2018-01-22 19:45:28,atiku,,68,126,458,"Glad all the students are unhurt and kudos to the fire service whose quick action saved so many. The Dry/Harmattan season witnesses more fires so need for extra caution by the people. https://punchng.com/80-students-escape-death-in-sokoto/ …",,,,955526851396587520,https://twitter.com/atiku/status/955526851396587520
2018-01-22 14:22:28,atiku,,65,173,634,"Today, democracy takes firmer roots in Africa as Liberia installs @GeorgeWeahOff as new president. A new dawn of democracy begins today.",,@GeorgeWeahOff,,955445565902508034,https://twitter.com/atiku/status/955445565902508034
2018-01-22 08:00:35,atiku,,320,536,1554,"A fire incident in Kano just days after Yola and Ibadan is unfortunate. Our markets and commercial centres must be equipped with standby facilities in order to facilitate prompt response to fire outbreaks. Small scale businesses must be protected from avoidable upsets.",,,,955349460497915904,https://twitter.com/atiku/status/955349460497915904
2018-01-21 14:01:52,atiku,,421,1659,4657,"Former President Obasanjo has shown with his P.hD that even at 80 dreams can still be realised. Congratulations, Sir.pic.twitter.com/9yhppmYXqm",,,,955077990530109440,https://twitter.com/atiku/status/955077990530109440
2018-01-21 11:46:02,atiku,,395,724,1658,"Congratulations Dr. Isa Odidi, who just setup a world class pharmaceuticals manufacturing plant in China, the first by a Nigerian and African.pic.twitter.com/08Q2MtD70K",,,,955043807858495488,https://twitter.com/atiku/status/955043807858495488
2018-01-21 11:03:54,atiku,real_kingtabs,79,335,597,"It doesn’t matter which service put out the fires. The most important thing is lives were saved and we are grateful for that.https://twitter.com/kingtabs002/status/954955291484966912 …",,,,955033204083314691,https://twitter.com/atiku/status/955033204083314691
2018-01-20 16:54:18,atiku,,300,675,2585,"Great win for #Arsenal and nice we got a goal from our own @alexiwobi. #Happy",,@alexiwobi,#Arsenal #Happy,954758999471161345,https://twitter.com/atiku/status/954758999471161345
2018-01-19 09:10:48,atiku,,182,410,1250,"My deepest sympathies to all those who lost property in the fires that destroyed the Yola Township Market and the Plank Market in Ibadan. I’m deeply grateful for the heroic firemen whose prompt response arrested the spread the fire.",,,,954279967436824576,https://twitter.com/atiku/status/954279967436824576
