date,username,to,replies,retweets,favorites,text,geo,mentions,hashtags,id,permalink
2016-09-28 19:44:13,atiku,atiku,15,210,116,"And above all else, we need to understand that our most valuable resource is not our oil; it is our people. All of our people.",,,,781217971205177345,https://twitter.com/atiku/status/781217971205177345
2016-09-28 19:43:54,atiku,atiku,17,89,38,"What are the solutions?pic.twitter.com/O1wFWOFNAr",,,,781217894055178240,https://twitter.com/atiku/status/781217894055178240
2016-09-28 19:41:57,atiku,atiku,11,123,62,"Another flawed belief is that the FG alone is the only force, the know-all, that would direct & bankroll the diversification of our economy",,,,781217399538352128,https://twitter.com/atiku/status/781217399538352128
2016-09-28 19:40:20,atiku,atiku,17,155,72,"Our biggest problem is our addiction to oil revenues; the belief that we are doomed unless oil money fills the treasury for sharing.",,,,781216994611822592,https://twitter.com/atiku/status/781216994611822592
2016-09-28 19:37:20,atiku,atiku,37,173,62,"To me, our economy is broken because our economic model doesn’t work. To fix it, we need to restructure our government finances.",,,,781216237783281664,https://twitter.com/atiku/status/781216237783281664
2016-09-28 19:36:08,atiku,atiku,28,271,131,"Our constant complaints about the oil price, pipeline vandals and lack of funds tend to distract us from the real challenges we are facing.",,,,781215935919185920,https://twitter.com/atiku/status/781215935919185920
2016-09-28 19:35:23,atiku,,45,261,178,"Our economy is broken, and if we wait for the oil price to rebound, we may wait for a long time. https://www.facebook.com/Atiku.org/posts/10154591757039640:0 …",,,,781215748781928448,https://twitter.com/atiku/status/781215748781928448
2016-09-26 11:17:51,atiku,Dev4Security,13,25,56,"Enjoy your day #smilehttps://twitter.com/dev4security/status/780170951086465024 …",,,#smilehttps,780365763588816897,https://twitter.com/atiku/status/780365763588816897
2016-09-24 18:43:58,atiku,HHMustaphaAA,16,106,89,"That's what you said last year. But thank you #Smilehttps://twitter.com/mustyblax/status/779748220901715972 …",,,#Smilehttps,779753256478203904,https://twitter.com/atiku/status/779753256478203904
2016-09-24 17:23:34,atiku,,169,367,184,"I'm trying to reach my son @Mustyblax on phone. He's not picking up. I wonder what is happening.",,@Mustyblax,,779733022681735168,https://twitter.com/atiku/status/779733022681735168
2016-09-23 18:14:17,atiku,MatthewTPage,6,9,25,"Thank you for coming. And for visiting our children.https://twitter.com/matthewtpage/status/779370145840062465 …",,,,779383400817909761,https://twitter.com/atiku/status/779383400817909761
2016-09-23 06:56:38,atiku,mydeji247,50,64,117,"Well, that is my wife, Titi, and Sola, a family friend. Yes, we all used to dress like Fela in those days.https://twitter.com/mydeji247/status/779039958787035137 …",,,,779212862631907328,https://twitter.com/atiku/status/779212862631907328
2016-09-22 18:55:40,atiku,atiku,144,549,571,"I remember how we used to dance to King Sunny Ade's music. You had to know the moves to be cool in Lagos back then.pic.twitter.com/0eU7ubIpIT",,,,779031425689452544,https://twitter.com/atiku/status/779031425689452544
2016-09-22 11:07:21,atiku,,46,407,486,"From the 1960's to date, Sunny Ade's music will always be timeless. I wish the King many happy returns as he turns 70 today.pic.twitter.com/8mpTB7ZU44",,,,778913570390208513,https://twitter.com/atiku/status/778913570390208513
2016-09-19 11:02:58,atiku,,39,114,128,"Feeding children for a year will solve a problem. Feeding & educating them for a year solves a lifetime of problemspic.twitter.com/gwT6zzyJQw",,,,777825302294691841,https://twitter.com/atiku/status/777825302294691841
2016-09-17 09:24:38,atiku,,88,114,169,"The death of my District Head, Muhammadu Ardo is shocking news. I pray Allah repose his soul and admit him into Firdaus.",,,,777075780711047168,https://twitter.com/atiku/status/777075780711047168
2016-09-14 19:09:34,atiku,PremiumTimesng,14,19,43,"Very well put. #restructuringhttps://twitter.com/premiumtimesng/status/776060227791630341 …",,,#restructuringhttps,776135822143844352,https://twitter.com/atiku/status/776135822143844352
2016-09-14 10:47:14,atiku,atiku,57,146,149,"I didn't study business administration in school, but as an investor, I've learned to identify good opportunities, and find good managers.",,,,776009407415062528,https://twitter.com/atiku/status/776009407415062528
2016-09-14 10:44:39,atiku,alalkali,29,134,136,"A Master of Business Administration may be more useful running a business than starting one. There is always room.https://twitter.com/alalkali/status/775983026148896768 …",,,,776008756534603776,https://twitter.com/atiku/status/776008756534603776
2016-09-14 08:06:06,atiku,atiku,36,135,103,"We are all shareholders in Nigeria. The best investment we can make in this country is to create jobs and value.",,,,775968853683765248,https://twitter.com/atiku/status/775968853683765248
2016-09-14 08:03:24,atiku,,51,224,274,"""How many jobs will it create?"" My son asked this question when we were reviewing an investment, and I knew he's been listening to me.",,,,775968176546938880,https://twitter.com/atiku/status/775968176546938880
2016-09-12 11:26:50,atiku,,90,237,310,"#EidMubarak from me and my family to you and yours.pic.twitter.com/jD1WWRC6rP",,,#EidMubarak,775294596695941120,https://twitter.com/atiku/status/775294596695941120
2016-09-08 12:04:31,atiku,buchi_holding,17,52,88,"Many of these children were displaced as babies. This is the first school they've attended, due to the insurgencyhttps://twitter.com/buchi_holding/status/773853909488136192 …",,,,773854528538107904,https://twitter.com/atiku/status/773854528538107904
2016-09-08 12:00:04,atiku,atiku,21,70,104,"After school, the kids are fed meals prepared by women in the community, to deepen local economic impact.pic.twitter.com/RaFEj8ZXQx",,,,773853405592821760,https://twitter.com/atiku/status/773853405592821760
2016-09-08 11:52:25,atiku,,40,149,238,"Meeting the children of our Feed & Read programme always fills me with joy. They've come so far!pic.twitter.com/XelyiIe6Na",,,,773851481858568192,https://twitter.com/atiku/status/773851481858568192
2016-09-08 11:38:53,atiku,PremiumTimesng,8,66,88,"Big congratulations to our girls. Saw first hand the hard work they put into their studies. Thank you, faculty!https://twitter.com/premiumtimesng/status/773467076698710017 …",,,,773848074842173440,https://twitter.com/atiku/status/773848074842173440
2016-09-07 08:05:19,atiku,atiku,10,43,51,"The task of rebuilding the North East is an onerous one. Join the @AUNFoundation and others to #SupportIDPs http://www.aunf.org",,@AUNFoundation,#SupportIDPs,773431942519881728,https://twitter.com/atiku/status/773431942519881728
2016-09-07 08:03:36,atiku,atiku,12,97,80,"As the security situation in the North East continues improving and the IDPs return to their homes, I implore us all to #SupportIDPs",,,#SupportIDPs,773431509915164672,https://twitter.com/atiku/status/773431509915164672
2016-09-07 07:58:26,atiku,,39,239,204,"I am very pleased to hear that Damboa market, Borno State, closed after 2014 Boko Haram attacks, has been reopenedhttp://www.premiumtimesng.com/regional/nnorth-east/209917-damboa-market-shut-2014-boko-haram-attacks-re-opens.html …",,,,773430208691113984,https://twitter.com/atiku/status/773430208691113984
2016-09-06 08:20:12,atiku,,176,446,636,"Another grandchild!pic.twitter.com/sdns3c7Udj",,,,773073300637581312,https://twitter.com/atiku/status/773073300637581312
2016-09-05 18:32:38,atiku,atiku,14,64,64,"His dedication to human rights activism and his fight for democracy will forever inspire us.",,,,772865036373155840,https://twitter.com/atiku/status/772865036373155840
2016-09-05 18:32:15,atiku,,24,188,195,"Today we remember Chief Gani Fawehinmi (SAN), who passed on 7 years ago.pic.twitter.com/pdcxMCEAHZ",,,,772864940986236928,https://twitter.com/atiku/status/772864940986236928
2016-09-02 15:45:06,atiku,,57,175,364,"Congratulations to Governor Kashim Shettima of Borno State on your 50th birthday. Many happy returns.pic.twitter.com/V9JDltnS2i",,,,771735711330529284,https://twitter.com/atiku/status/771735711330529284
2016-08-26 07:46:13,atiku,Ibidudu,18,39,71,"Always great to meet @AUNigeria parents. Thank you for the trust!https://twitter.com/ibidudu/status/768913002707968001 …",,@AUNigeria,,769078481045098496,https://twitter.com/atiku/status/769078481045098496
2016-08-25 12:54:05,atiku,ADB_Gombe,16,32,48,"Congratulations to her.https://twitter.com/adb_gombe/status/768786734721138688 …",,,,768793571176710144,https://twitter.com/atiku/status/768793571176710144
2016-08-23 16:35:30,atiku,,28,186,198,"Happy birthday Sultan of Sokoto, Muhammadu Sa'ad Abubakar IV, a wonderful father and great leader. Many happy returns.",,,,768124515008282624,https://twitter.com/atiku/status/768124515008282624
2016-08-18 18:50:10,atiku,AUNigeria,19,52,59,"Congratulations to the successful applicants.https://twitter.com/aunigeria/status/766273203404693504 …",,,,766346466176667652,https://twitter.com/atiku/status/766346466176667652
2016-08-18 11:35:09,atiku,,7,39,42,"Nigerian university tackles extremism and hunger @AUNigeriahttp://bbc.in/2bpF3tb",,@AUNigeriahttp,,766236990769627137,https://twitter.com/atiku/status/766236990769627137
2016-08-18 10:29:36,atiku,BBCAfrica,13,46,63,"So proud of the work @AUNigeria is doing in the North East. @MargeeEnsignhttps://twitter.com/bbcafrica/status/765720285354098688 …",,@AUNigeria @MargeeEnsignhttps,,766220494945325056,https://twitter.com/atiku/status/766220494945325056
2016-08-16 17:08:23,atiku,Eldukku_,2,12,20,"In various ways, yes.https://twitter.com/el_dukku/status/761851610788143104 …",,,,765596077617709056,https://twitter.com/atiku/status/765596077617709056
2016-08-13 21:07:22,atiku,,49,238,155,"Against all odds, the Eagles have made it to the Olympic semi-finals. #Proud #NigeriaSpirit",,,#Proud #NigeriaSpirit,764569054069792768,https://twitter.com/atiku/status/764569054069792768
2016-08-12 16:55:19,atiku,,35,186,246,"Thumbs up to all Nigerian youths making an impact everywhere. You are resilient, never give up on yourself. #IYD2016 http://atiku.org/aa/2016/08/12/happy-international-youth-day/ …",,,#IYD2016,764143235690266624,https://twitter.com/atiku/status/764143235690266624
2016-08-12 14:35:56,atiku,,9,71,65,"Happy birthday Chief John Odigie-Oyegun, Chairman @APCNigeria. Many happy returns.",,@APCNigeria,,764108159829045248,https://twitter.com/atiku/status/764108159829045248
2016-08-11 19:02:29,atiku,WHO,21,45,45,"I'm terribly saddened. All hands back on deck!https://twitter.com/who/status/763799815272759296 …",,,,763812849978408960,https://twitter.com/atiku/status/763812849978408960
2016-08-10 20:08:00,atiku,realanifon,35,59,77,"My cattle are in ranches. Currently, we supplement grass with the feed from our factory.https://twitter.com/realanifon/status/763084880003510272 …",,,,763466950110539776,https://twitter.com/atiku/status/763466950110539776
2016-08-10 20:07:03,atiku,CaptinoOlawale,60,246,200,"Haha. Even I never thought I'd be the person I am today, considering my background. Education does great things.https://twitter.com/captinoolawale/status/763100440762413061 …",,,,763466714348740608,https://twitter.com/atiku/status/763466714348740608
2016-08-09 18:35:10,atiku,owolabitaiwo,21,61,79,"I've owned farms since the 80's, my young friend. I grew up as a farm and herd boy.https://twitter.com/owolabitaiwo/status/763079968146464769 …",,,,763081201238310912,https://twitter.com/atiku/status/763081201238310912
2016-08-09 18:29:42,atiku,atiku,14,50,41,"Imagine if we tried to fill our silos with grain from subsistence? Pooling farmers helps reduce supply shortages.pic.twitter.com/miDzj7X8xJ",,,,763079825988911104,https://twitter.com/atiku/status/763079825988911104
2016-08-09 18:24:20,atiku,atiku,8,45,36,"Easiest was to meet larger tonnage demands is aggregating farmers, so they all put their produce into a pool. This is what our factory does.",,,,763078475297222661,https://twitter.com/atiku/status/763078475297222661
2016-08-09 18:22:15,atiku,atiku,7,55,33,"One of the problems Nigeria has with agriculture export is consistency of supply. Export request is in tonnes every month.",,,,763077951604793345,https://twitter.com/atiku/status/763077951604793345
2016-08-09 18:20:16,atiku,atiku,11,50,34,"Almost everyday, cargo planes from Europe pickup fresh produce along the West African coast? Nigeria (the hub) contributes least to cargo",,,,763077451828305920,https://twitter.com/atiku/status/763077451828305920
2016-08-09 18:11:38,atiku,Hlimited,8,32,31,"I agree, @Hlimited. But agriculture shouldn't just focus on farming. The downstream value chain is limitless.",,@Hlimited,,763075278054776833,https://twitter.com/atiku/status/763075278054776833
2016-08-08 15:06:03,atiku,,30,166,180,"Asiwaju, looking every inch the proud father of the groom today.pic.twitter.com/VFcy8paGsB",,,,762666187780136960,https://twitter.com/atiku/status/762666187780136960
2016-08-07 20:18:23,atiku,OfficialAPCKD,42,485,228,"Very good result. She should apply. The scholarship is merit based, and I cannot personally award them.https://twitter.com/elrufai4kaduna/status/762210680736997376 …",,,,762382402165600256,https://twitter.com/atiku/status/762382402165600256
2016-08-06 09:58:56,atiku,yodifiji,13,49,63,"Dear Dr. Ayoade, I believe you misunderstood my tweet. My record of promoting women in politics is longstanding.https://twitter.com/yodifiji/status/761859939837079552 …",,,,761864124250849284,https://twitter.com/atiku/status/761864124250849284
2016-08-06 09:52:39,atiku,yodifiji,9,15,31,"No. I was having a conversation on rural entrepreneurship and micro-finance, so keeping focus on that @yodifiji",,@yodifiji,,761862542935396353,https://twitter.com/atiku/status/761862542935396353
2016-08-06 09:13:34,atiku,,10,34,49,"Agreed. I used to give money to farmers (men), as Atiku. After setting up the bank, better data changed our strategy https://twitter.com/derielle5/status/761514005550759936 …",,,,761852707196067840,https://twitter.com/atiku/status/761852707196067840
2016-08-06 09:12:07,atiku,yodifiji,23,73,72,"I would say differently- based on data, women are more efficient managers of resources in our local communities.https://twitter.com/yodifiji/status/761520868090605568 …",,,,761852343747022848,https://twitter.com/atiku/status/761852343747022848
2016-08-06 09:09:48,atiku,sourcecfo,8,27,34,"If I answer honestly - data and experience has shown us what not to do. But what to do is still work in progress.https://twitter.com/sourcecfo/status/761555561414623232 …",,,,761851759702736896,https://twitter.com/atiku/status/761851759702736896
2016-08-05 11:12:13,atiku,atiku,44,289,138,"I hope men don't think I'm abusing them. I was just sharing our experience in grassroots lending. #smile",,,#smile,761520179692048384,https://twitter.com/atiku/status/761520179692048384
2016-08-05 11:01:28,atiku,atiku,24,288,137,"After years of experience and data, our grassroots lending strategy has completely evolved. We know who to lend to. Guess who it is? #Smile",,,#Smile,761517471782363140,https://twitter.com/atiku/status/761517471782363140
2016-08-05 10:59:04,atiku,atiku,17,346,130,"They told the men, don't tell anyone that you're getting this loan. Did it work? 7/11 men in that training married new wives immediately!",,,,761516868255551488,https://twitter.com/atiku/status/761516868255551488
2016-08-05 10:55:32,atiku,atiku,11,289,115,"So I said, ""why don't we train the men to be more secretive when they received the loan?"" Our managers laughed, but started the training.",,,,761515981495799809,https://twitter.com/atiku/status/761515981495799809
2016-08-05 10:49:24,atiku,atiku,11,421,164,"Our loan programme managers found out that when the men got their loans, the whole village heard. Women just quietly about their business.",,,,761514436087672832,https://twitter.com/atiku/status/761514436087672832
2016-08-05 10:40:04,atiku,atiku,9,351,133,"From this experience & data, when we started distributing improve seeds to IDPs to start farms, we decided to put special focus on the women",,,,761512086941949956,https://twitter.com/atiku/status/761512086941949956
2016-08-05 10:37:13,atiku,atiku,10,448,194,"In fact, the women were making so much money, most are now the breadwinners of their families, sending their children to good schools.",,,,761511369753694208,https://twitter.com/atiku/status/761511369753694208
2016-08-05 10:36:18,atiku,atiku,5,408,172,"We started the Ecossentials programme, converting waste to products, and it become profitable. 95% of the participants were women.",,,,761511140161622016,https://twitter.com/atiku/status/761511140161622016
2016-08-05 10:27:14,atiku,atiku,44,942,365,"We founded our micro-finance bank to lend to our local people - men took the money and married new wives, women repaid 90% of the time.",,,,761508856111456258,https://twitter.com/atiku/status/761508856111456258
2016-08-05 10:22:44,atiku,,62,1360,886,"In Africa, especially Nigeria, women make better grassroots entrepreneurs. They also have deeper impacts in their communities.",,,,761507724773449729,https://twitter.com/atiku/status/761507724773449729
2016-08-05 10:18:20,atiku,ebhota_al,48,26,31,"Let's put it this way, we've had this system for a while, are we where want to be as a country/economy?https://twitter.com/ebhota_al/status/761421027524091905 …",,,,761506617963741184,https://twitter.com/atiku/status/761506617963741184
2016-08-04 08:57:03,atiku,NewsWireNGR,39,82,67,"Nigeria's history shows that restructuring is a conversation we should pay attention to.https://twitter.com/newswirengr/status/761086306751356928 …",,,,761123775714689026,https://twitter.com/atiku/status/761123775714689026
2016-08-03 12:14:19,atiku,,21,147,79,"#Smile The groom is the governor's younger brother. In my culture, the groom doesn't come asking, his elders do. https://twitter.com/drdamages/status/760776742789386240 …",,,#Smile,760811031295819776,https://twitter.com/atiku/status/760811031295819776
2016-08-01 07:04:15,atiku,ogundamisi,24,67,42,"Absolutely. The mistake we make is that we equate a call for more economically viable structure for disunity - it isn't. @ogundamisi",,@ogundamisi,,760008223743238144,https://twitter.com/atiku/status/760008223743238144
2016-08-01 07:02:12,atiku,ogundamisi,20,108,72,"My speeches do not in any way ask for more states - I'm asking for states to cooperate & pool resources @ogundamisipic.twitter.com/KA2aT5o6mt",,@ogundamisipic,,760007707185278976,https://twitter.com/atiku/status/760007707185278976
2016-08-01 07:00:22,atiku,ogundamisi,45,193,116,"Not true. I do not support creating more states. In fact, I advocate for them to pool resources at regional level.https://twitter.com/ogundamisi/status/760006017770020864 …",,,,760007248076738560,https://twitter.com/atiku/status/760007248076738560
2016-08-01 06:54:19,atiku,,36,59,67,"Why restructuring: With current fiscal structure, states are now unable to survive without federal allocations. http://atiku.org/aa/2016/07/30/restructuring-nigeria-for-greater-national-integration-and-democratic-stability/ …",,,,760005723694698496,https://twitter.com/atiku/status/760005723694698496
2016-07-31 14:35:29,atiku,,72,125,135,"Important read: Restructuring Nigeria For Greater National Integration And Democratic Stability http://atiku.org/aa/2016/07/30/restructuring-nigeria-for-greater-national-integration-and-democratic-stability/ …",,,,759759393793646592,https://twitter.com/atiku/status/759759393793646592
2016-07-30 21:30:14,atiku,DeeOneAyekooto,33,138,77,"#Smile This is patently untrue. I support restructuring, always have, but never spoke about new states.https://twitter.com/deeoneayekooto/status/759496372999553024 …",,,#Smile,759501378293202944,https://twitter.com/atiku/status/759501378293202944
2016-07-29 09:50:31,atiku,schrodingerr,25,72,89,"As an agriculture investor in the North East, I have seen climate change first hand. We need more action.https://twitter.com/schrodingerr/status/758947285283713026 …",,,,758962904297201664,https://twitter.com/atiku/status/758962904297201664
2016-07-28 19:15:41,atiku,atiku,26,62,84,"In the old times, I would have had to pretend I'm a mean father, and not smile. Haha, too happy to not smile.",,,,758742741861797888,https://twitter.com/atiku/status/758742741861797888
2016-07-28 19:08:45,atiku,,81,244,372,"Tradition! DIG Nuhu Aliyu led Gov Abubakar Sani Bello's delegation to ask the hand of my daughter in marriagepic.twitter.com/JC07UPvxOB",,,,758741000038719494,https://twitter.com/atiku/status/758741000038719494
2016-07-27 20:41:07,atiku,rhodakusimo,10,23,42,"I have looked on the faces of many of these women, and the joy is indescribable.https://twitter.com/rhodakusimo/status/758386943734538240 …",,,,758401854120263680,https://twitter.com/atiku/status/758401854120263680
2016-07-27 08:01:45,atiku,atiku,17,52,65,"“Today Feels like Sallah Day” - Fadimatu Yahaya. This gives me so much joy.pic.twitter.com/YR4Stf9kQ9",,,,758210756009689088,https://twitter.com/atiku/status/758210756009689088
2016-07-27 07:58:40,atiku,,58,184,195,"This week, we began the new phase of long term support for IDPs - improved seeds distributed to 1000 farmers, to rebuild their lives.",,,,758209980524859393,https://twitter.com/atiku/status/758209980524859393
2016-07-26 19:29:01,atiku,atiku,16,54,56,"Our next obvious step is ensuring that internally displaced people find their feet again. Starting from ourselves.",,,,758021322266017792,https://twitter.com/atiku/status/758021322266017792
2016-07-25 07:40:34,atiku,atiku,10,69,82,"Having seen up close how polio destroys young lives, nothing excites me more than the stream of good news that the disease is gone!",,,,757480649183862784,https://twitter.com/atiku/status/757480649183862784
2016-07-25 07:35:40,atiku,EndPolioNow,28,69,100,"Great to see the impact these organisations made, helping #endpolio. Very accountable too!https://twitter.com/endpolionow/status/306512877416767488 …",,,#endpolio,757479413873250304,https://twitter.com/atiku/status/757479413873250304
2016-07-24 16:08:42,atiku,,40,108,53,"I doubt if the scores of lower & middle income @AUNigeria students on full scholarships would agree. #smile https://twitter.com/sir_elmusty/status/757228812685803520 …",,@AUNigeria,#smile,757246135706714112,https://twitter.com/atiku/status/757246135706714112
2016-07-24 11:23:04,atiku,,29,149,112,"Today, we marked 2 years polio free in Nigeria. Great news. Looking forward to WHO ""Polio Free"" certification in 2017.",,,,757174253682847744,https://twitter.com/atiku/status/757174253682847744
2016-07-23 11:35:54,atiku,jambash_xox,29,43,66,"The selection is competitive and merit based. If he qualifies or passes, he will get the scholarship.https://twitter.com/jambash_xox/status/756772446062075904 …",,,,756815094860877824,https://twitter.com/atiku/status/756815094860877824
2016-07-22 15:46:12,atiku,,59,893,389,"Please tell your friends about the @AUNigeria scholarships. There are 67 slots this yearpic.twitter.com/4nSeQQTVSp",,@AUNigeria,,756515696822059009,https://twitter.com/atiku/status/756515696822059009
2016-07-22 10:41:31,atiku,,30,94,186,"Meeting with the Speaker of the parliament, Republic of Niger, His Excellency Ousseini Tinni, at my home yesterday.pic.twitter.com/CRkDM84XtO",,,,756439022143172612,https://twitter.com/atiku/status/756439022143172612
2016-07-19 16:48:15,atiku,atiku,14,147,85,"My deep gratitude to our armed forces and countless volunteers, who have worked to bring peace back to our North East communities.",,,,755444149332082690,https://twitter.com/atiku/status/755444149332082690
2016-07-19 16:46:41,atiku,atiku,17,205,105,"Today, as with my recent visits to Borno, I have seen real change on the streets. Peace has returned to the state. I'm very happy about this",,,,755443756745236480,https://twitter.com/atiku/status/755443756745236480
2016-07-19 16:44:43,atiku,omonlakiki,5,82,72,"My condolences to the Shettima Monguno family, the Shehu of Borno, the government and people of Borno State.https://twitter.com/omonlakiki/status/755437870853263360 …",,,,755443262148706305,https://twitter.com/atiku/status/755443262148706305
2016-07-19 07:33:59,atiku,,80,156,229,"From thick bushes a few months ago, construction has begun on the site for our new factory.pic.twitter.com/nn6zYOKhe1",,,,755304663033970688,https://twitter.com/atiku/status/755304663033970688
2016-07-18 16:58:25,atiku,,53,1161,358,". @AUNigeria is offering 67 new scholarships. Please share with friends and familypic.twitter.com/4nSeQQTVSp",,@AUNigeria,,755084321329930240,https://twitter.com/atiku/status/755084321329930240
2016-07-17 08:08:22,atiku,atiku,95,312,178,"The inclination of our youth towards religious intolerance is becoming alarming. Peaceful, inter-faith coexistence is crucial for Nigeria.",,,,754588542165278720,https://twitter.com/atiku/status/754588542165278720
2016-07-17 08:02:28,atiku,,90,267,189,"Condemnable. The security agencies must bring the perpetrators to book to serve as a deterrent. https://twitter.com/nigerianewsdesk/status/754406087282028544 …",,,,754587054726578176,https://twitter.com/atiku/status/754587054726578176
2016-07-16 17:55:35,atiku,,44,258,143,"A lesson for us all: People Power is greater than military power #Turkey",,,#Turkey,754373929381269508,https://twitter.com/atiku/status/754373929381269508
2016-07-14 18:39:47,atiku,,41,109,227,"I was happy to see two patriots & friends, Ray Ekpu & Soji Akinrinade today. Talked old memories and media practice.pic.twitter.com/Q5Pc0V0Pmq",,,,753660280522104832,https://twitter.com/atiku/status/753660280522104832
