date,username,to,replies,retweets,favorites,text,geo,mentions,hashtags,id,permalink
2019-01-20 09:55:08,atiku,,1262,2315,6986,"Yesterday, I returned to Nigeria after my whistle-stop tour of D.C where I was able to share my plan to get Nigeria working again with members of congress, business community & our citizens abroad. Key to the success of my plan will be to drive inward investment and trade deals.pic.twitter.com/MgVbIT8pK2",,,,1086925083132735488,https://twitter.com/atiku/status/1086925083132735488
2019-01-19 18:33:36,atiku,,2578,5078,10123,"I however challenge President Buhari to choose a date and time for a debate where he will be present and I will be there, hopefully with the other candidates as well. Thank you and God bless the Federal Republic of Nigeria. Atiku Abubakar",,,,1086693169528479750,https://twitter.com/atiku/status/1086693169528479750
2019-01-19 18:33:35,atiku,,1284,3289,6914,"With respect to my fellow candidates, Fela Durotoye, Oby Ezekwesili, Kingsley Moghalu & to moderator Mark Sugar & with apologies to Nigerians here & at home expecting an interesting debate, I regret I will not be able to go on with this debate due to President Buhari's absence.",,,,1086693167796310019,https://twitter.com/atiku/status/1086693167796310019
2019-01-19 18:33:35,atiku,,467,2071,3601,"As a leader and former vice president of the Federal Republic of Nigeria, let me first apologise to all Nigerians, my fellow candidates and the moderator for the APC Presidential Candidate’s absence in this debate. His non-appearance is a slight on ALL of us and our democracy.",,,,1086693165711720451,https://twitter.com/atiku/status/1086693165711720451
2019-01-19 18:33:34,atiku,,965,2472,4712,"Afterall, you cannot shave a man's head in his absence. I do not believe in attacking a man who is NOT here to defend himself.",,,,1086693163836887041,https://twitter.com/atiku/status/1086693163836887041
2019-01-19 18:33:34,atiku,,3237,6581,13661,"We came here for a Presidential debate, not a candidacy debate, and I, Atiku Abubakar cannot challenge or question an administration where the man at the helm of the affairs of the nation is not present to defend himself or his policies. #2019Debatepic.twitter.com/crperoO3tT",,,#2019Debatepic,1086693161341198337,https://twitter.com/atiku/status/1086693161341198337
2019-01-19 18:12:29,atiku,,1330,2711,6434,"I arrived the Congress Hall of the Hilton venue of the #2019Debate. This debate and the election is a referendum on the incumbent.pic.twitter.com/nXh7Vk4VZ6",,,#2019Debate,1086687857207664641,https://twitter.com/atiku/status/1086687857207664641
2019-01-19 13:45:27,atiku,,393,1103,3900,"Earlier at a town hall meeting with PDP members in D.C Metropolis. Total support for our plan to get Nigeria working again. #BetterNigeria #LetsGetNigeriaWorkingAgainpic.twitter.com/PwmsgACljH",,,#BetterNigeria #LetsGetNigeriaWorkingAgainpic,1086620654517002242,https://twitter.com/atiku/status/1086620654517002242
2019-01-19 06:59:09,atiku,,700,1911,5132,"At the business roundtable @USChamber, I shared my plan to get Nigeria working again. I also reiterated my commitment to devolution of powers at the centre thereby allowing for a smaller, and more effective federal government. #LetsGetNigeriaWorkingAgain #BetterNigeriapic.twitter.com/KfvoTF1a9u",,@USChamber,#LetsGetNigeriaWorkingAgain #BetterNigeriapic,1086518409020477440,https://twitter.com/atiku/status/1086518409020477440
2019-01-18 21:31:15,atiku,,689,1779,6069,"At @VOANews earlier today to discuss my visit and plans on enabling further US investments in Nigeria, job creation and opportunities for Nigerians. #BetterNigeria #LetsGetNigeriaWorkingAgainpic.twitter.com/2GzBWEK4EM",,@VOANews,#BetterNigeria #LetsGetNigeriaWorkingAgainpic,1086375490372411392,https://twitter.com/atiku/status/1086375490372411392
2019-01-18 17:44:41,atiku,,701,1638,5701,"Just met with representatives of Nigerians in D.C metropolis. Discussed my plans and commitment to work with the diaspora to get Nigeria working again. #LetsGetNigeriaWorkingAgain #BetterNigeriapic.twitter.com/gDXbfJYHP9",,,#LetsGetNigeriaWorkingAgain #BetterNigeriapic,1086318474014720003,https://twitter.com/atiku/status/1086318474014720003
2019-01-17 19:26:04,atiku,,3234,7097,17329,"Just arrived Washington D.C for meeting with US government officials, Nigerians living in D.C metropolis and the business community. -AApic.twitter.com/EafM47B83A",,,,1085981600024797185,https://twitter.com/atiku/status/1085981600024797185
2019-01-16 16:16:16,atiku,,119,416,1339,"I call on the creative industry to release a very short film telling Nigerians to go out and vote. #AtikuMeetsCreativeIndustry",,,#AtikuMeetsCreativeIndustry,1085571447257513986,https://twitter.com/atiku/status/1085571447257513986
2019-01-16 16:16:15,atiku,,40,244,935,"I am also committed to appointing industry professionals. #AtikuMeetsCreativeIndustry",,,#AtikuMeetsCreativeIndustry,1085571444426375168,https://twitter.com/atiku/status/1085571444426375168
2019-01-16 16:16:15,atiku,,31,170,503,"I commit that my government will implement relevant laws that will boost and provide an enabling environment for the creative industry. #AtikuMeetsCreativeIndustry",,,#AtikuMeetsCreativeIndustry,1085571441972662272,https://twitter.com/atiku/status/1085571441972662272
2019-01-16 16:16:13,atiku,,50,288,893,"I am totally committed to supporting the creative industry to make it a big supplier of prosperity to our country. Further, to make it grow and provide as many jobs as possible, tax incentive is necessary. #AtikuMeetsCreativeIndustrypic.twitter.com/XOM2grOlfa",,,#AtikuMeetsCreativeIndustrypic,1085571435924471809,https://twitter.com/atiku/status/1085571435924471809
2019-01-16 16:16:08,atiku,,192,765,2576,"This industry is a rapidly growing industry and is virtually driven by our own young men and women which means it reflects the ingenuity of millions of young Nigerians. Today, my candidature, our focus, is focused on the youth. #AtikuMeetsCreativeIndustrypic.twitter.com/eT4x9vOEIy",,,#AtikuMeetsCreativeIndustrypic,1085571414902620161,https://twitter.com/atiku/status/1085571414902620161
2019-01-16 14:03:23,atiku,,1847,4115,15458,"My #10YearChallenge. #Smilepic.twitter.com/7gbsBr3Iea",,,#10YearChallenge #Smilepic,1085538006226874368,https://twitter.com/atiku/status/1085538006226874368
2019-01-16 11:33:09,atiku,,330,761,2891,"I am 100% confident we will get Nigeria working again. #AtikuMeetsBusinessCommunity",,,#AtikuMeetsBusinessCommunity,1085500196971261952,https://twitter.com/atiku/status/1085500196971261952
2019-01-16 10:50:09,atiku,,156,876,2769,"I have been operating one of the most successful and efficient Micro Finance Banks. The bank alone has lifted 45,000 families out of poverty. And the policy I gave the bank was that 80% of loans go to women. Currently, I have recovery rate of 98%. #AtikuMeetsBusinessCommunitypic.twitter.com/5HfAFHT95t",,,#AtikuMeetsBusinessCommunitypic,1085489377843785729,https://twitter.com/atiku/status/1085489377843785729
2019-01-16 10:37:32,atiku,,64,340,932,"I can give you that guarantee. Whoever cannot fit into a job cannot be hired. #AtikuMeetsBusinessCommunity",,,#AtikuMeetsBusinessCommunity,1085486203531657216,https://twitter.com/atiku/status/1085486203531657216
2019-01-16 10:36:03,atiku,,40,328,804,"I don’t believe in giving people jobs which they don’t know how to do. I cannot hire anybody I cannot learn from. #AtikuMeetsBusinessCommunity",,,#AtikuMeetsBusinessCommunity,1085485830238621698,https://twitter.com/atiku/status/1085485830238621698
2019-01-16 10:36:03,atiku,,40,284,689,"For a technology driven economy. You cannot get that achieved without introducing education in your policy. It starts from education. If you get education right, you will get everything else right. #AtikuMeetsBusinessCommunitypic.twitter.com/ePmQuQMawy",,,#AtikuMeetsBusinessCommunitypic,1085485827088625664,https://twitter.com/atiku/status/1085485827088625664
2019-01-16 10:35:56,atiku,,532,1703,4970,"I will reduce the size of the federal government completely. I support restructuring and we will liberalize several sectors of the Economy. #AtikuMeetsBusinessCommunitypic.twitter.com/EFgXWBeU3w",,,#AtikuMeetsBusinessCommunitypic,1085485800949772288,https://twitter.com/atiku/status/1085485800949772288
2019-01-15 18:59:14,atiku,,574,1775,6435,"Thank you Osun for choosing PDP. A vote for PDP is a vote for enhanced security & self employment for the youth & women. Also enhanced opportunities through agriculture, small scale enterprise, improved education skills, sales of cash crops & production facilities at farm levels.pic.twitter.com/RCpDLmAlvp",,,,1085250072076521475,https://twitter.com/atiku/status/1085250072076521475
2019-01-15 12:13:56,atiku,,203,888,3620,"In honour of our fallen heroes who died in the line of duty, today I joined other Nigerians at a prayer session for our Armed Forces at the PDP secretariat in Akure, Ondo state. May the souls of our fallen heroes continue to Rest In Peace. #ArmedForcesRemembranceDaypic.twitter.com/427oE8eT32",,,#ArmedForcesRemembranceDaypic,1085148073662337024,https://twitter.com/atiku/status/1085148073662337024
2019-01-14 15:35:04,atiku,,549,1428,5075,"Thanks to the people of Ekiti State. I commit to you we will build the interstate roads & complete all federal projects not completed. We’ll restore quality education and we'll create more jobs. I also recommit 40% of my cabinet to youth and 30% to women. #PDPEkitiRallypic.twitter.com/0y2MdokKol",,,#PDPEkitiRallypic,1084836301311012864,https://twitter.com/atiku/status/1084836301311012864
2019-01-13 18:08:34,atiku,,634,1042,3464,"Nigerians are being left behind. The forthcoming elections in February offer the opportunity for a change. https://www.express.co.uk/news/world/1071282/brexit-news-britain-trade-deal-nigeria …",,,,1084512543798976514,https://twitter.com/atiku/status/1084512543798976514
2019-01-13 16:32:16,atiku,,94,384,1258,"My thoughts and prayers are with families of the persons who lost dear ones in the tragic incident in Iworoko Ekiti on Saturday night. I pray for the repose of the souls of the dead and that God comforts the affected families.https://www.vanguardngr.com/2019/01/mother-child-13-others-killed-in-ekiti-road-tragedy/ …",,,,1084488308426711045,https://twitter.com/atiku/status/1084488308426711045
2019-01-13 14:27:49,atiku,,490,1325,5703,"I received with sadness news of the loss in a road accident of Mrs Christy Dungtou & Mr Morkwap of one of our support groups on their way from Jos. 3 others are hospitalised. My prayers are with the deceased families. I've directed that no resource be spared to treat the injured.",,,,1084456991186214915,https://twitter.com/atiku/status/1084456991186214915
2019-01-12 19:00:44,atiku,,529,987,3577,"I was at Bukuru IDP camp today. Rainy season is approaching and they requested support to buy building materials and resettle themselves. Being human, I was touched by their living conditions and announced a donation. I will hand over same to you now. - AApic.twitter.com/zfUSuVfzaC",,,,1084163285086277632,https://twitter.com/atiku/status/1084163285086277632
2019-01-12 17:04:21,atiku,,742,1831,6707,"My brothers and sisters of Plateau state, thank you for choosing PDP. I promise you, we are going to work and restore peace and unity in Plateau. My government will ensure the provision of jobs and we will provide business enablement for those who want to own businesses.pic.twitter.com/W0hLOS4hZL",,,,1084133997846974464,https://twitter.com/atiku/status/1084133997846974464
2019-01-11 18:08:03,atiku,,663,1612,5838,"Today, I met with Ambassador of France to Nigeria, HE Jérôme Pasquier. We had fruitful discussions on bilateral relations, also the deteriorating security in the Northeast and how France can support Nigeria within the EU framework to ensure a free, fair and credible elections.pic.twitter.com/YDjVubh1HB",,,,1083787639004766208,https://twitter.com/atiku/status/1083787639004766208
2019-01-11 17:55:28,atiku,,159,586,1819,"Mothers are most concerned about the direction of our economy. If our children cannot get jobs, mothers cannot sleep. My job as president will be to bring peace of mind to mothers all over Nigeria, by ensuring their children can find jobs.",,,,1083784470862462979,https://twitter.com/atiku/status/1083784470862462979
2019-01-11 17:55:27,atiku,,177,824,2735,"Women are at the heart of our families, businesses and communities. This is why, one of my first exclusive events this campaign was with the women of our party today, to discuss my policy and plans for them. #PDPWomensConferencepic.twitter.com/e4onP0hLgR",,,#PDPWomensConferencepic,1083784467062366208,https://twitter.com/atiku/status/1083784467062366208
2019-01-10 18:46:20,atiku,,515,1130,3714,"Thank you Nasarawa state. Today is proof that you have accepted PDP. And for the youth and women of this country, I repeat, 40% of my government will go to the youth and 30% to the women. This is because I want you to succeed us. #PDPNasarawaRally #BetterNigeria #LGNWApic.twitter.com/9CB6kuiZLh",,,#PDPNasarawaRally #BetterNigeria #LGNWApic,1083434885652586497,https://twitter.com/atiku/status/1083434885652586497
2019-01-10 18:09:38,atiku,,187,685,2441,"I’m elated at the eventual resolution of the electoral dispute in DR Congo. I congratulate President-Elect, Felix Tshisekedi and urge him to brace up for the work ahead of him. I believe a new Africa is possible where power will truly belong to the people.https://www.channelstv.com/2019/01/10/oppositions-tshisekedi-declared-winner-of-drc-presidential-poll/ …",,,,1083425647198916608,https://twitter.com/atiku/status/1083425647198916608
2019-01-10 16:57:35,atiku,,423,1016,4715,"I received with shock the loss of Emir of Lafia and Chairman, Nasarawa State Council of Chiefs, Alhaji Isa Mustapha Agwai. He will be remembered amongst others as an educationist and humanitarian. May Allah grant him AlJannah Firdaus.",,,,1083407519253516289,https://twitter.com/atiku/status/1083407519253516289
2019-01-10 10:05:03,atiku,,199,788,3621,"Happy birthday Governor Aminu Tambuwal @AWTambuwal. Thank you for all you do for the great state of Sokoto and Nigeria. I wish you many more years in good health and service. -AApic.twitter.com/wzssDiiiu9",,@AWTambuwal,,1083303699248754688,https://twitter.com/atiku/status/1083303699248754688
2019-01-09 19:32:44,atiku,,373,938,3748,"On my visit to Minna, I visited the burnt market during which I met with traders affected in the unfortunate incident.pic.twitter.com/zDrVqvETfj",,,,1083084175228440579,https://twitter.com/atiku/status/1083084175228440579
2019-01-09 17:14:49,atiku,,1906,2953,8668,"My fellow brothers and sisters, I want to promise you that if you vote PDP we will restore the jobs you lost. You will either get a job or get a business to do. This is a promise I am making on behalf of PDP if you vote for PDP. #PDPNigerRally #BetterNigeria #LGNWApic.twitter.com/ucGJEul7rx",,,#PDPNigerRally #BetterNigeria #LGNWApic,1083049464284073984,https://twitter.com/atiku/status/1083049464284073984
2019-01-07 19:34:36,atiku,,402,1262,4573,"The attempted coup in Gabon stands condemned. Military rule is an aberration and has no place in Africa. The African Union, in line with its rules, should stand firm on its zero tolerance for forceful alteration of government on the continent. -AA",,,,1082359869271916544,https://twitter.com/atiku/status/1082359869271916544
2019-01-07 16:52:26,atiku,,886,2088,6910,"I feel at home in Kogi State. Ajaokuta, also the two power stations in Kogi and the stadium are legacies of the PDP. Creation of jobs is the priority of the PDP. The abandoned projects of the APC will be completed. #PDPKogiRallypic.twitter.com/Py4FsuT8y2",,,#PDPKogiRallypic,1082319057775443971,https://twitter.com/atiku/status/1082319057775443971
2019-01-06 21:05:36,atiku,,145,739,1750,"If Daily Trust as an institution or any of its staff is in breach of the law, I recommend that due process be followed and not a resort to the jackboot.",,,,1082020382771683333,https://twitter.com/atiku/status/1082020382771683333
2019-01-06 21:05:36,atiku,,447,1840,3405,"I have received with concern news of the sealing of Daily Trust corporate headquarters in Abuja. Freedom of the press is the bedrock of our democracy and nothing should be done to compromise it.https://www.vanguardngr.com/2019/01/breaking-soldiers-shut-down-daily-trust-offices-in-abuja-borno-arrest-editor-reporter/ …",,,,1082020379189751809,https://twitter.com/atiku/status/1082020379189751809
2019-01-06 19:30:47,atiku,,1975,4822,12459,"To that Onitsha goat seller who could not sell his goods due to the prevailing bad economy, I say to you that I care. You and all Nigerians are my business. You are my priority. Join me and #LetsGetNigeriaWorkingAgain and I assure you that next Sallah will be better.",,,#LetsGetNigeriaWorkingAgain,1081996521300770817,https://twitter.com/atiku/status/1081996521300770817
2019-01-04 12:50:39,atiku,,895,1863,5226,"For a #betternigeria with visionary leadership that will see our economy & institutions working again we must all take collective action. And this will be done only through our choices. I urge you to go out & collect your Permanent Voter’s Card (PVCs). #LetsGetNigeriaWorkingAgainpic.twitter.com/ymdCwPrYcV",,,#betternigeria #LetsGetNigeriaWorkingAgainpic,1081171048131895297,https://twitter.com/atiku/status/1081171048131895297
2019-01-03 17:40:19,atiku,,283,722,2199,"I condole with the families & the Air Force over the death of 5 gallant NAF officials in a helicopter crash. May the souls of Fl. Lt. Perowei Jacob, Fl. Lt. Kaltho Kilyofas, Sgt. Auwal Ibrahim, L. Cpl Adamu Nura & Aircraftman Meshack, rest in peace. -AAhttps://www.premiumtimesng.com/news/headlines/303955-boko-haram-five-nigerian-air-force-officials-die-in-helicopter-crash.html …",,,,1080881557592780800,https://twitter.com/atiku/status/1080881557592780800
2019-01-03 15:18:07,atiku,,560,970,4415,"It is with sadness I received news of the loss of AVM Hamza Abdullahi, former governor of Kano State and one-time minister of FCT. It was under his watch as minister that Abuja Phase 1 was constructed. May Allah SWT grant him Aljannah Firdaus. Ameen.",,,,1080845771589730305,https://twitter.com/atiku/status/1080845771589730305
2018-12-31 10:10:20,atiku,,487,853,2855,"As 2018 comes to an end and 2019 beckons, on behalf of my family and I, let me wish you and your family a very happy New Year in advance. Full text: https://www.facebook.com/14312764639/posts/10156930651464640?sfns=st …pic.twitter.com/xkBm9kAMIF",,,,1079681149365075968,https://twitter.com/atiku/status/1079681149365075968
2018-12-28 20:39:23,atiku,,267,606,2266,"After his untimely overthrow from office, he continued to devote his time and effort to nation building through the elder statesmanly role he played, including during my time in office as Vice President. He will be greatly missed. May Almighty Allah grant him Aljannah Firdaus.",,,,1078752292738871296,https://twitter.com/atiku/status/1078752292738871296
2018-12-28 20:39:22,atiku,,399,1493,5371,"President Shehu Usman Shagari was a completely detribalized Nigerian. He served Nigeria from his youth to the evening of his life, as a teacher & moulder of minds and later as a leader and moulder of nations.",,,,1078752287923814401,https://twitter.com/atiku/status/1078752287923814401
2018-12-28 07:27:40,atiku,,1390,2293,6795,"My message to the good people of Zamfara state. I am saddened by the banditry and killings that have affected your state and by God’s grace, I will do everything possible to bring the killers to book and prevent further killings.pic.twitter.com/lqJytx9ZO0",,,,1078553052829896704,https://twitter.com/atiku/status/1078553052829896704
2018-12-26 21:06:39,atiku,,262,615,3397,"Happy 51st birthday @YakubDogara, 14th speaker, @HouseNGR. You remain a beacon of hope and exemplary leadership. Wishing you long life with good health and vitality.pic.twitter.com/lQIT70vff3",,@YakubDogara @HouseNGR,,1078034379115544576,https://twitter.com/atiku/status/1078034379115544576
2018-12-26 17:49:47,atiku,,116,354,1109,"Healthcare delivery services for persons with disabilities will be reviewed and updated to reflect the present-day realities and address 21st century needs of persons living with disabilities.",,,,1077984836701294595,https://twitter.com/atiku/status/1077984836701294595
2018-12-26 17:49:47,atiku,,89,343,1128,"We will involve private sector transportation operators to increase access to transportation and create incentives for those who operate wheelchair accessible buses.",,,,1077984833912082432,https://twitter.com/atiku/status/1077984833912082432
2018-12-26 17:49:46,atiku,,33,168,450,"We will also make readily available teaching and learning aids through duty free import or support for local production of such aids - and also importantly, we will increase availability of schools that can provide special needs services.",,,,1077984830854451201,https://twitter.com/atiku/status/1077984830854451201
2018-12-26 17:49:45,atiku,,38,173,444,"In the area of education, we will implement trainings for special needs professionals to offer services within the education sector and ensure strict monitoring and evaluation of schools providing special care for people with special needs.",,,,1077984828199501825,https://twitter.com/atiku/status/1077984828199501825
2018-12-26 17:49:44,atiku,,51,171,485,"We will also increase funding to the MDAs that carter to persons with special needs and disabilities.",,,,1077984825292795905,https://twitter.com/atiku/status/1077984825292795905
2018-12-24 17:15:19,atiku,,381,930,2297,"The recent killings in Magami village in Faru District of Maradun LGA of Zamfara is one too many. The people of Zamfara and indeed all peoples of Nigeria deserve to live in peace and safety.https://www.premiumtimesng.com/news/headlines/302640-just-in-riot-in-zamfara-over-insecurity.html …",,,,1077251388281946113,https://twitter.com/atiku/status/1077251388281946113
2018-12-23 15:47:46,atiku,,1103,1999,7758,"This Christmas, I urge all Nigerians to spare a thought for our military on the frontlines on the war on terror. I had cause to telephone Lt. Col. Ibrahim Sakaba’s widow this Yuletide. I am touched by her devotion & love for her husband who paid the supreme sacrifice for Nigeria.pic.twitter.com/fUEK9ZzYaJ",,,,1076866967112482818,https://twitter.com/atiku/status/1076866967112482818
2018-12-21 17:02:46,atiku,,147,419,1355,"CSOs & political parties have to partner in protecting rule of law, freedom & democracy in Nigeria. If we joke with this country, we will end up with a dictatorship. But I can assure you, all my life I have fought for democracy & against dictatorship & will continue to fight it!pic.twitter.com/YAbMj2lC11",,,,1076161065950552064,https://twitter.com/atiku/status/1076161065950552064
2018-12-21 17:02:39,atiku,,639,1368,4271,"So if we want our citizens who have excelled abroad to return home, let us provide what they get there, and this is doable because we have the human and material resources to do it. This is how I believe our experts abroad can return home. #AtikuMeetsCSOspic.twitter.com/VLTGKkjYvc",,,#AtikuMeetsCSOspic,1076161033457356800,https://twitter.com/atiku/status/1076161033457356800
2018-12-19 18:07:59,atiku,,721,1913,6233,"My town hall meeting today in Aba with manufacturers/business owners reinforces my conviction that leadership is the only next thing our country is waiting for to reclaim its greatness. We will get Nigeria working again when our manufacturers get the support they need to thrive.pic.twitter.com/fs3SV9Ofwr",,,,1075452699280314369,https://twitter.com/atiku/status/1075452699280314369
2018-12-19 13:07:25,atiku,,656,1591,4978,"The killing of former Chief of Defence Staff, Air Marshal Sabundu Alex Badeh is a stark reminder of the state of insecurity in our land. May God grant strength and comfort to his family to bear this irreparable loss.",,,,1075377062662340608,https://twitter.com/atiku/status/1075377062662340608
2018-12-19 09:03:02,atiku,,534,1601,6731,"Happy 56th birthday to the Director General, Presidential Campaign Council of our great party @OfficialPDPNig, also leader and chairman of Nigeria’s 8th National Assembly. I wish you many more years in good health in service to our country and humanity. #SarakiAt56pic.twitter.com/91acBnQLH8",,@OfficialPDPNig,#SarakiAt56pic,1075315557669527552,https://twitter.com/atiku/status/1075315557669527552
2018-12-18 17:06:59,atiku,,1137,2812,8167,"My message to the great and good people of Kaduna state. I am pained by the recent upheavals that have affected your state and by God’s grace, I will do everything possible to return peace to Kaduna.pic.twitter.com/t3DCi62nex",,,,1075074960136253440,https://twitter.com/atiku/status/1075074960136253440
2018-12-18 16:28:10,atiku,,473,1592,5168,"Gombe! #PDPNorthEastRallypic.twitter.com/d6Td93q7tK",,,#PDPNorthEastRallypic,1075065191669338114,https://twitter.com/atiku/status/1075065191669338114
2018-12-17 16:33:01,atiku,,1344,4180,17128,"I wish President @MBuhari a happy birthday even as my family and I pray for long life for him. Despite the fact that we will meet at the polls soon, I very much affirm that we are brothers born from the womb of One Nigeria. Happy birthday. -AA",,@MBuhari,,1074704026430775297,https://twitter.com/atiku/status/1074704026430775297
2018-12-14 21:58:17,atiku,,2685,6618,19668,"I watched with pride as @PeterObi laid out our vision to get Nigeria working again. Can’t wait for the presidential debate. #2019Debate",,@PeterObi,#2019Debate,1073698719579734016,https://twitter.com/atiku/status/1073698719579734016
