date,username,to,replies,retweets,favorites,text,geo,mentions,hashtags,id,permalink
2016-04-21 06:51:56,ScottMorrisonMP,,19,4,9,"Bowen’s boast that banks would pass #ASIC user pay costs to consumers failed to survive a day http://sjm.ministers.treasury.gov.au/media-release/043-2016/ …",,,#ASIC,723041561106206720,https://twitter.com/ScottMorrisonMP/status/723041561106206720
2016-04-21 02:35:44,ScottMorrisonMP,,13,10,21,"Today I am with @TurnbullMalcolm & @cpyne to launch Australia's Cyber Security Strategy #auspolpic.twitter.com/wl202qAm5i",,@TurnbullMalcolm @cpyne,#auspolpic,722977088479760384,https://twitter.com/ScottMorrisonMP/status/722977088479760384
2016-04-20 09:07:23,ScottMorrisonMP,,13,3,6,"I spoke to @leighsales earlier today about #ASIC for tonight's @abc730 #auspol",,@leighsales @abc730,#ASIC #auspol,722713262874304512,https://twitter.com/ScottMorrisonMP/status/722713262874304512
2016-04-20 07:23:02,ScottMorrisonMP,,5,0,1,"Transcript: Press conference with @KellyODwyer #auspol http://sjm.ministers.treasury.gov.au/transcript/053-2016/ …",,@KellyODwyer,#auspol,722687002496352256,https://twitter.com/ScottMorrisonMP/status/722687002496352256
2016-04-20 05:17:30,ScottMorrisonMP,,10,5,9,"Consumers will be better protected from misconduct in Aus financial services industry w/ $127.2 mil reform package http://sjm.ministers.treasury.gov.au/media-release/042-2016/ …",,,,722655410000371712,https://twitter.com/ScottMorrisonMP/status/722655410000371712
2016-04-20 03:57:52,ScottMorrisonMP,,22,13,19,"w/ @KellyODwyer announcing the Turnbull Govt's reform package to strengthen our financial sector watchdog #auspolpic.twitter.com/cngCwIRP6Q",,@KellyODwyer,#auspolpic,722635368248569856,https://twitter.com/ScottMorrisonMP/status/722635368248569856
2016-04-20 00:15:27,ScottMorrisonMP,,7,0,4,"I will be holding a press conference with @KellyODwyer in Canberra at 10.30am #auspol",,@KellyODwyer,#auspol,722579397299941379,https://twitter.com/ScottMorrisonMP/status/722579397299941379
2016-04-19 01:55:37,ScottMorrisonMP,,14,2,10,"That is not a plan for growth and jobs. 3/3",,,,722242215108476928,https://twitter.com/ScottMorrisonMP/status/722242215108476928
2016-04-19 01:55:18,ScottMorrisonMP,,20,17,25,"I can confirm, however, that Labor is proposing to increase the tax burden on the Aus economy by over $100b over the next 10 years. 2/3",,,,722242136901484545,https://twitter.com/ScottMorrisonMP/status/722242136901484545
2016-04-19 01:53:52,ScottMorrisonMP,,11,5,13,"As usual Bill Shorten is getting over excited. Public reports speculating on the Budget are not accurate. The Budget is on May 3. 1/3",,,,722241773825699841,https://twitter.com/ScottMorrisonMP/status/722241773825699841
2016-04-18 22:30:52,ScottMorrisonMP,,21,17,43,"Bill Shorten's #RSRT has been abolished. The Turnbull Govt will always back enterprising small business. #auspolpic.twitter.com/48Jbp0tbdG",,,#RSRT #auspolpic,722190689098801152,https://twitter.com/ScottMorrisonMP/status/722190689098801152
2016-04-15 05:25:36,ScottMorrisonMP,,41,17,24,"The Turnbull Government is backing hardworking Australians by clearing a path for jobs & growth #auspolpic.twitter.com/crBzWea2JF",,,#auspolpic,720845508600705024,https://twitter.com/ScottMorrisonMP/status/720845508600705024
2016-04-15 02:46:03,ScottMorrisonMP,,2,1,0,"Transcript: Doorstop in Sydney #auspol http://sjm.ministers.treasury.gov.au/transcript/051-2016/ …",,,#auspol,720805355253444608,https://twitter.com/ScottMorrisonMP/status/720805355253444608
2016-04-15 02:43:20,ScottMorrisonMP,,18,6,4,". @Bowenchris on @Lateline highlighted the sham of Labor’s costings & cynical election driven policy strategy #auspol http://sjm.ministers.treasury.gov.au/media-release/039-2016/ …",,@Bowenchris @Lateline,#auspol,720804671925846017,https://twitter.com/ScottMorrisonMP/status/720804671925846017
2016-04-14 07:22:53,ScottMorrisonMP,,2,0,3,"Transcript: Doorstop interview in Sydney at @modularwalls #auspol http://sjm.ministers.treasury.gov.au/transcript/050-2016/ …",,@modularwalls,#auspol,720512636417392640,https://twitter.com/ScottMorrisonMP/status/720512636417392640
2016-04-14 07:15:38,ScottMorrisonMP,,6,1,8,"At @modularwalls in the Shire to discuss Govt's focus on driving investment, to drive growth, which drives jobs.pic.twitter.com/kLhtarqFbf",,@modularwalls,,720510810527768576,https://twitter.com/ScottMorrisonMP/status/720510810527768576
2016-04-14 05:05:42,ScottMorrisonMP,,15,6,16,"Congrats to the 26,100 Australians who were employed in March & the businesses that employed them - Turnbull Govt is backing jobs & growth",,,,720478113977798656,https://twitter.com/ScottMorrisonMP/status/720478113977798656
2016-04-14 02:15:41,ScottMorrisonMP,,0,0,1,"Transcript: @amworldtodaypm with @m_brisso #auspol http://sjm.ministers.treasury.gov.au/transcript/049-2016/ …",,@amworldtodaypm @m_brisso,#auspol,720435327144370176,https://twitter.com/ScottMorrisonMP/status/720435327144370176
2016-04-14 00:12:53,ScottMorrisonMP,,7,5,2,"#Budget2016 will focus on encouraging economic growth and jobs to deliver greater living standards for Australians http://lbr.al/mcpo",,,#Budget2016,720404421067190273,https://twitter.com/ScottMorrisonMP/status/720404421067190273
2016-04-13 23:56:03,ScottMorrisonMP,,1,0,0,"Transcript: @SkyNewsAust with @David_Speers http://sjm.ministers.treasury.gov.au/transcript/048-2016/ …",,@SkyNewsAust @David_Speers,,720400188272062464,https://twitter.com/ScottMorrisonMP/status/720400188272062464
2016-04-13 06:57:57,ScottMorrisonMP,,48,28,19,"It appears my twitter account may have been accessed by someone unauthorised to do so. This has been rectified.",,,,720143971490467840,https://twitter.com/ScottMorrisonMP/status/720143971490467840
2016-04-12 08:52:15,ScottMorrisonMP,,12,8,12,"Speaking today on our transitioning economy & Labor's reckless negative gearing proposal http://sjm.ministers.treasury.gov.au/transcript/047-2016/ …pic.twitter.com/dt5BwVWU7W",,,,719810348958658560,https://twitter.com/ScottMorrisonMP/status/719810348958658560
2016-04-12 06:46:30,ScottMorrisonMP,,41,11,28,"Labor was warned its #negativegearing policy would be an economic disaster & would hurt mum & dad investors #auspolpic.twitter.com/oLFfdViyff",,,#negativegearing #auspolpic,719778705027895296,https://twitter.com/ScottMorrisonMP/status/719778705027895296
2016-04-12 05:11:48,ScottMorrisonMP,,7,1,1,"Fact Sheet: ASIC and Royal Commission http://sjm.ministers.treasury.gov.au/media-release/038-2016/ …",,,,719754870283046912,https://twitter.com/ScottMorrisonMP/status/719754870283046912
2016-04-12 04:03:51,ScottMorrisonMP,,13,5,10,"The Govt is committed to ensuring WA's successful transition to a stronger more diversified & innovative economypic.twitter.com/XS04fjBw3a",,,,719737771351416832,https://twitter.com/ScottMorrisonMP/status/719737771351416832
2016-04-12 03:55:01,ScottMorrisonMP,,3,2,0,"Transcript: doorstop interview in Sydney http://sjm.ministers.treasury.gov.au/transcript/046-2016/ …",,,,719735548017901569,https://twitter.com/ScottMorrisonMP/status/719735548017901569
2016-04-11 01:30:40,ScottMorrisonMP,,30,11,26,"Outside @RBAInfo discussing Govt's plan for jobs & growth while @billshortenmp just wants to play politicspic.twitter.com/dGjqbkC3IK",,@RBAInfo @billshortenmp,,719336832312324100,https://twitter.com/ScottMorrisonMP/status/719336832312324100
2016-04-08 02:13:52,ScottMorrisonMP,,14,4,13,"In Melb announcing essential infrastructure funding for Vic w/ @TurnbullMalcolm @PaulFletcherMP & Vic colleaguespic.twitter.com/7SPEiPPxpY",,@TurnbullMalcolm @PaulFletcherMP,,718260540141867008,https://twitter.com/ScottMorrisonMP/status/718260540141867008
2016-04-08 02:00:11,ScottMorrisonMP,,2,0,0,"Transcript: @SkyNewsAust with @David_Speers #auspol http://sjm.ministers.treasury.gov.au/transcript/043-2016/ …",,@SkyNewsAust @David_Speers,#auspol,718257097754951681,https://twitter.com/ScottMorrisonMP/status/718257097754951681
2016-04-08 01:59:20,ScottMorrisonMP,,2,2,0,"Transcript: @RNBreakfast with @frankelly08 #auspol http://sjm.ministers.treasury.gov.au/transcript/044-2016/ …",,@RNBreakfast @frankelly08,#auspol,718256884839497729,https://twitter.com/ScottMorrisonMP/status/718256884839497729
2016-04-07 21:36:59,ScottMorrisonMP,,2,5,5,"Joining @frankelly08 now on @RadioNational Breakfast #auspolpic.twitter.com/gFLNgPEQ4C",,@frankelly08 @RadioNational,#auspolpic,718190863092830208,https://twitter.com/ScottMorrisonMP/status/718190863092830208
2016-04-07 05:59:44,ScottMorrisonMP,,10,4,4,"I'll be on @SkyNewsAust shortly with @David_Speers #auspol",,@SkyNewsAust @David_Speers,#auspol,717954996411568128,https://twitter.com/ScottMorrisonMP/status/717954996411568128
2016-04-05 00:30:36,ScottMorrisonMP,,49,19,54,"We have put a stop to the boats & restored order to our immigration programme.pic.twitter.com/MD2GIKfWGx",,,,717147388742225921,https://twitter.com/ScottMorrisonMP/status/717147388742225921
2016-04-03 23:19:02,ScottMorrisonMP,,9,3,5,"Up soon on @2GB873 with #RayHadley - Listen live on http://www.2gb.com/listen-live",,@2GB873,#RayHadley,716766993731297286,https://twitter.com/ScottMorrisonMP/status/716766993731297286
2016-04-01 00:01:16,ScottMorrisonMP,,19,37,52,"Our reforms to country of origin food labelling gives shoppers the chance to support local jobs & growth #auspolpic.twitter.com/I6tbEuNcpH",,,#auspolpic,715690459075448832,https://twitter.com/ScottMorrisonMP/status/715690459075448832
2016-03-31 08:26:13,ScottMorrisonMP,,13,2,11,"Tune in to my interview with @leighsales on @abc730 tonight #auspolpic.twitter.com/s0mnohmfTk",,@leighsales @abc730,#auspolpic,715455144217825281,https://twitter.com/ScottMorrisonMP/status/715455144217825281
2016-03-29 23:28:26,ScottMorrisonMP,,2,5,6,"Opening up competition in clearing of cash equities is in line with the Govt's commitment to competition law reform http://sjm.ministers.treasury.gov.au/media-release/034-2016/ …",,,,714957418267090944,https://twitter.com/ScottMorrisonMP/status/714957418267090944
2016-03-29 00:48:41,ScottMorrisonMP,,19,12,22,"A competitive, sustainable & successful construction sector is essential to our transitioning economy #ABCC #auspolpic.twitter.com/VHPw2joXlo",,,#ABCC #auspolpic,714615227367567362,https://twitter.com/ScottMorrisonMP/status/714615227367567362
2016-03-28 22:06:17,ScottMorrisonMP,,11,2,3,"I'll be speaking to #RayHadley on @2GB873 this morning at 9.20am",,@2GB873,#RayHadley,714574356160983040,https://twitter.com/ScottMorrisonMP/status/714574356160983040
2016-03-24 05:58:35,ScottMorrisonMP,,33,11,18,"90% of jobs growth in the past year was in the services sector demonstrating Australia’s transition to our new economy #auspol",,,#auspol,712881273790971905,https://twitter.com/ScottMorrisonMP/status/712881273790971905
2016-03-24 04:48:47,ScottMorrisonMP,,17,10,15,"Employment in services sector up by 210,000 jobs in the past year, proof of Aust's successful transition from the resources boom @ABSStats",,@ABSStats,,712863710235242496,https://twitter.com/ScottMorrisonMP/status/712863710235242496
2016-03-24 00:51:22,ScottMorrisonMP,,21,17,27,"The construction industry employs one million Australians & is vital to the transition to the new economy #auspolpic.twitter.com/uUCBJ02DfG",,,#auspolpic,712803961963556864,https://twitter.com/ScottMorrisonMP/status/712803961963556864
2016-03-21 02:42:24,ScottMorrisonMP,,10,25,21,"Check out the Government's #Fintech statement via http://fintech.treasury.gov.au #ideasboom #auspol",,,#Fintech #ideasboom #auspol,711744738961940480,https://twitter.com/ScottMorrisonMP/status/711744738961940480
2016-03-21 01:04:10,ScottMorrisonMP,,2,16,19,"Govt’s FinTech statement sets out our vision for a strong & vibrant #FinTech industry in Aus to boost jobs & growth http://sjm.ministers.treasury.gov.au/media-release/032-2016/ …",,,#FinTech,711720017969094656,https://twitter.com/ScottMorrisonMP/status/711720017969094656
2016-03-21 00:40:41,ScottMorrisonMP,,3,18,34,"This morning I am at @stoneandchalk to release the Turnbull Government's #FinTech statement #ideasboompic.twitter.com/7NMTNID54v",,@stoneandchalk,#FinTech #ideasboompic,711714107993362432,https://twitter.com/ScottMorrisonMP/status/711714107993362432
2016-03-17 23:52:22,ScottMorrisonMP,,13,10,13,"From 31 March 2016 #FIRB will formally review critical infrastructure assets sold by State & Territory Govts #auspolpic.twitter.com/yIdIzgt2zV",,,#FIRB #auspolpic,710614785188990976,https://twitter.com/ScottMorrisonMP/status/710614785188990976
2016-03-17 11:11:18,ScottMorrisonMP,,30,15,34,"Our Senate voting reforms will ensure that future Senate election results reflect the will of the Australian peoplepic.twitter.com/r2nKX56wl6",,,,710423260404396032,https://twitter.com/ScottMorrisonMP/status/710423260404396032
2016-03-17 01:12:09,ScottMorrisonMP,,30,6,21,"Labor’s rushed & reckless policies will hurt investment, discourage enterprise & impact hardworking Australians.pic.twitter.com/JoqzlPrYQ5",,,,710272476870103040,https://twitter.com/ScottMorrisonMP/status/710272476870103040
2016-03-16 21:21:03,ScottMorrisonMP,,8,4,6,"Competition reform will better protect consumers & boost economic growth & jobs #auspol http://sjm.ministers.treasury.gov.au/media-release/030-2016/ …pic.twitter.com/yYOEB162wB",,,#auspol,710214317551955968,https://twitter.com/ScottMorrisonMP/status/710214317551955968
2016-03-16 06:43:29,ScottMorrisonMP,,8,8,10,". @Tony_Burke Another rush to failure just like their negative gearing policy...pic.twitter.com/qN9jClNAsw",,@Tony_Burke,,709993472141475840,https://twitter.com/ScottMorrisonMP/status/709993472141475840
2016-03-16 02:37:04,ScottMorrisonMP,,4,5,5,". @turnbullmalcolm @kellyodwyermp & I announced Govt will implement #HarperReview recommendation on Section46 #auspolpic.twitter.com/e4JetSW644",,@turnbullmalcolm @kellyodwyermp,#HarperReview #auspolpic,709931458308124672,https://twitter.com/ScottMorrisonMP/status/709931458308124672
2016-03-15 22:32:37,ScottMorrisonMP,,10,14,13,"The Tax Incentives for Innovation Bill will encourage innovation, risk taking & entrepreneurialism in Aus #auspol http://sjm.ministers.treasury.gov.au/media-release/029-2016/ …",,,#auspol,709869942619840512,https://twitter.com/ScottMorrisonMP/status/709869942619840512
2016-03-15 02:34:13,ScottMorrisonMP,,28,7,21,"There's never been a more important time to focus on innovation, infrastructure & incentive in our economy #auspolpic.twitter.com/hx0OXg1oq8",,,#auspolpic,709568352893558784,https://twitter.com/ScottMorrisonMP/status/709568352893558784
2016-03-15 02:30:02,ScottMorrisonMP,,4,2,2,"At the @afrsummit I discussed the Govt's commitment to back the earners in our economy to drive growth #auspol http://sjm.ministers.treasury.gov.au/speech/002-2016/ …",,@afrsummit,#auspol,709567301805154304,https://twitter.com/ScottMorrisonMP/status/709567301805154304
2016-03-13 23:38:10,ScottMorrisonMP,,46,17,19,"Labor must come clean with the Aust people & answer for the ramifications of their proposals http://sjm.ministers.treasury.gov.au/media-release/028-2016/ …pic.twitter.com/rEXjanJMdm",,,,709161661869862912,https://twitter.com/ScottMorrisonMP/status/709161661869862912
2016-03-13 09:53:34,ScottMorrisonMP,,8,4,21,"An honor to be presented 2016 season's #1 Ticket Holder of the mighty @Cronulla_Sharks #WeAreSharks #UpUpCronullapic.twitter.com/82Cptwu3li",,@Cronulla_Sharks,#1 #WeAreSharks #UpUpCronullapic,708954146603335680,https://twitter.com/ScottMorrisonMP/status/708954146603335680
2016-03-10 22:07:44,ScottMorrisonMP,,25,4,7,"Legacy of Labor’s #negativegearing policy will be a lost decade of reduced home building & higher rents @BISShrapnel http://www.afr.com/opinion/bis-shrapnel-why-limiting-negative-gearing-would-push-up-rents-20160309-gnf5y9 …",,@BISShrapnel,#negativegearing,708051739098763264,https://twitter.com/ScottMorrisonMP/status/708051739098763264
2016-03-10 01:44:08,ScottMorrisonMP,,8,4,7,". @ABSStats 12,900 days lost to industrial disputes in construction Dec quarter '15. But Labor doesn't care. We need to bring back the ABCC.",,@ABSStats,,707743812248965121,https://twitter.com/ScottMorrisonMP/status/707743812248965121
2016-03-10 01:41:38,ScottMorrisonMP,,10,2,9,"Bringing back the ABCC is critical to supporting the successful transition in our economy that will drive jobs and growth. #auspol",,,#auspol,707743182134452224,https://twitter.com/ScottMorrisonMP/status/707743182134452224
2016-03-10 00:51:46,ScottMorrisonMP,,2,0,3,"Aust's FinTech sector can play a vital role in the positive transition occurring in our economy #ausbiz #auspolhttp://www.afr.com/opinion/columnists/fintech-the-next-wave-of-growth-20160309-gnemne …",,,#ausbiz #auspolhttp,707730631992545280,https://twitter.com/ScottMorrisonMP/status/707730631992545280
2016-03-09 06:11:40,ScottMorrisonMP,TurnbullMalcolm,5,1,10,"No Jab, No Pay is all about protecting our kids and keeping them safe, so they have the best start in life.https://twitter.com/TurnbullMalcolm/status/707365103264358400 …",,,,707448748587274240,https://twitter.com/ScottMorrisonMP/status/707448748587274240
2016-03-09 01:33:54,ScottMorrisonMP,,18,4,4,"Labor’s rushed & reckless #negativegearing policy will hurt investment and discourage enterprise http://sjm.ministers.treasury.gov.au/media-release/024-2016/ …",,,#negativegearing,707378846677344256,https://twitter.com/ScottMorrisonMP/status/707378846677344256
2016-03-08 04:11:18,ScottMorrisonMP,,19,16,19,"The Government is committed to addressing the barriers which limit women’s participation in the workforce #IWD2016pic.twitter.com/tcroMMV5WS",,,#IWD2016pic,707056072658321409,https://twitter.com/ScottMorrisonMP/status/707056072658321409
2016-03-07 04:22:01,ScottMorrisonMP,,106,26,38,"Labor’s #negativegearing policy will remove one of the real opportunities everyday people have to create wealthpic.twitter.com/9bbQrmnXQT",,,#negativegearing,706696382145363968,https://twitter.com/ScottMorrisonMP/status/706696382145363968
2016-03-07 01:26:39,ScottMorrisonMP,,6,1,1,"Further proof our economy is successfully transitioning from the mining investment boom 2/2",,,,706652246612676608,https://twitter.com/ScottMorrisonMP/status/706652246612676608
2016-03-07 01:26:21,ScottMorrisonMP,,6,2,3,"Over 1 million tourists have visited Australia in the past year from China. Over 100,000 in January 2016 – up 60% on January last year 1/2",,,,706652171203260416,https://twitter.com/ScottMorrisonMP/status/706652171203260416
2016-03-06 22:09:24,ScottMorrisonMP,,5,3,2,"Up soon with #RayHadley on @2GB873. Listen live http://www.2gb.com/listen-live #auspol",,@2GB873,#RayHadley #auspol,706602609780477953,https://twitter.com/ScottMorrisonMP/status/706602609780477953
2016-03-04 22:03:36,ScottMorrisonMP,,8,5,18,"It was terrific to meet @tinaarena last night after her show in Sydney. A great Australian & wonderful talent!pic.twitter.com/vKsJM5IO3U",,@tinaarena,,705876372896370688,https://twitter.com/ScottMorrisonMP/status/705876372896370688
2016-03-04 07:23:53,ScottMorrisonMP,,14,8,14,"Today's retail trade results show Australians are making our transitioning economy work #auspol #ausbizpic.twitter.com/EKy2i4DmyQ",,,#auspol #ausbizpic,705654984789000194,https://twitter.com/ScottMorrisonMP/status/705654984789000194
2016-03-02 22:48:21,ScottMorrisonMP,,17,6,8,"Speaking to the press gallery about Labor's reckless #negativegearing policy Read more: http://sjm.ministers.treasury.gov.au/transcript/027-2016/ …pic.twitter.com/gMDA4ue9cD",,,#negativegearing,705162858317778944,https://twitter.com/ScottMorrisonMP/status/705162858317778944
2016-03-02 21:37:48,ScottMorrisonMP,,67,8,6,"The @BISShrapnel report shows Labor's policy on #negativegearing will be bad for those who own a home, rent a home & invest in a home",,@BISShrapnel,#negativegearing,705145106156773376,https://twitter.com/ScottMorrisonMP/status/705145106156773376
2016-03-02 20:09:37,ScottMorrisonMP,,7,0,0,"About to go live with @m_brisso on @amworldtodaypm #auspolpic.twitter.com/f4p8lZTmK7",,@m_brisso @amworldtodaypm,#auspolpic,705122912743792641,https://twitter.com/ScottMorrisonMP/status/705122912743792641
2016-03-02 06:15:19,ScottMorrisonMP,,23,33,39,"Today’s #nationalaccounts shows further strong signs of the successful transition underway in our economy #auspolpic.twitter.com/JoNjS0PTG4",,,#nationalaccounts #auspolpic,704912954165170178,https://twitter.com/ScottMorrisonMP/status/704912954165170178
2016-03-02 02:39:08,ScottMorrisonMP,,3,3,5,"We are growing faster than every economy in the G7 and well above the OECD average #nationalaccounts Read more: http://sjm.ministers.treasury.gov.au/media-release/022-2016/ …",,,#nationalaccounts,704858549508149252,https://twitter.com/ScottMorrisonMP/status/704858549508149252
2016-03-02 00:52:21,ScottMorrisonMP,,2,3,4,"This is the strongest pace of through the year growth since the March quarter of 2014 #nationalaccounts @auspol",,@auspol,#nationalaccounts,704831675620929536,https://twitter.com/ScottMorrisonMP/status/704831675620929536
2016-03-02 00:52:01,ScottMorrisonMP,,12,34,35,"Aus real GDP grew 0.6% in Dec quarter & by 3.0% compared to a year ago, up 2.7% through the year to Sept #nationalaccounts #auspol",,,#nationalaccounts #auspol,704831593194491904,https://twitter.com/ScottMorrisonMP/status/704831593194491904
2016-03-02 00:51:42,ScottMorrisonMP,,2,4,4,"#nationalaccounts show Aus has maintained its strong economic performance & we are making the transition to broader based growth #auspol",,,#nationalaccounts #auspol,704831514752610305,https://twitter.com/ScottMorrisonMP/status/704831514752610305
2016-02-28 22:10:35,ScottMorrisonMP,,6,5,4,"I'll be chatting to #RayHadley on @2GB873 at 9.20am. Listen live http://www.2gb.com/listen-live",,@2GB873,#RayHadley,704066190935592961,https://twitter.com/ScottMorrisonMP/status/704066190935592961
2016-02-26 06:54:32,ScottMorrisonMP,,14,20,30,"Pleased to announce Govt will provide $150,000 for the @stoneandchalk FinTech Asia program http://sjm.ministers.treasury.gov.au/media-release/020-2016/ …pic.twitter.com/CeWVAWJZkp",,@stoneandchalk,,703110881672966147,https://twitter.com/ScottMorrisonMP/status/703110881672966147
2016-02-26 02:36:08,ScottMorrisonMP,cpyne,18,5,10,"China’s rapid economic growth represents an exceptional opportunity for Australian entrepreneurs #ideasboom #auspolhttps://twitter.com/cpyne/status/703043664293957634 …",,,#ideasboom #auspolhttps,703045853242482688,https://twitter.com/ScottMorrisonMP/status/703045853242482688
2016-02-25 23:04:06,ScottMorrisonMP,,4,8,5,"My Op-Ed in @FinancialReview about the importance of #foreigninvestment & not objecting to the sale of NZ owned VDLhttp://www.afr.com/opinion/chinese-dairy-play-was-in-our-interests-20160225-gn3oxz …",,@FinancialReview,#foreigninvestment,702992494963740672,https://twitter.com/ScottMorrisonMP/status/702992494963740672
2016-02-25 04:08:45,ScottMorrisonMP,,12,13,42,"Learning about financial technology development at the @CommBank Hong Kong Innovation Lab today #ideasboompic.twitter.com/noieFRLBW5",,@CommBank,#ideasboompic,702706774176976896,https://twitter.com/ScottMorrisonMP/status/702706774176976896
2016-02-24 04:50:18,ScottMorrisonMP,,14,15,16,"Today @TurnbullMalcolm @KellyODwyer @Wyatt_MP @cpyne & I attended the first meeting of the FinTech Advisory Grouppic.twitter.com/zbByEZSHPe",,@TurnbullMalcolm @KellyODwyer @Wyatt_MP @cpyne,,702354843084701696,https://twitter.com/ScottMorrisonMP/status/702354843084701696
2016-02-22 04:44:10,ScottMorrisonMP,,10,11,19,"Parliament today passed the Govt’s tough new laws that will protect consumers from excessive card surcharging http://sjm.ministers.treasury.gov.au/media-release/013-2016/ …",,,,701628523971121152,https://twitter.com/ScottMorrisonMP/status/701628523971121152
2016-02-21 23:16:48,ScottMorrisonMP,,27,12,29,"We are toughing up on tax for #foreigninvestment approvals. Read more: http://sjm.ministers.treasury.gov.au/media-release/010-2016/ … #auspolpic.twitter.com/m0Em7WXIFF",,,#foreigninvestment #auspolpic,701546137912680448,https://twitter.com/ScottMorrisonMP/status/701546137912680448
2016-02-19 02:14:23,ScottMorrisonMP,,62,22,23,"My comments on tax issues put back on the table by the PM were not a criticism of Mr Abbott or Mr Hockey but a statement of chronology",,,,700503668513120258,https://twitter.com/ScottMorrisonMP/status/700503668513120258
2016-02-18 22:07:26,ScottMorrisonMP,,12,5,5,"Chatting to @3AWNeilMitchell in #Melbourne on @3AW693pic.twitter.com/yZmJ24PSuS",,@3AWNeilMitchell @3AW693pic,#Melbourne,700441519614877696,https://twitter.com/ScottMorrisonMP/status/700441519614877696
2016-02-18 06:59:49,ScottMorrisonMP,,12,5,8,"Tonight I'm in #Adelaide speaking at the @SMSFassoc about providing stability & certainty for superannuationpic.twitter.com/1kcJCsQRxX",,@SMSFassoc,#Adelaide,700213110695546880,https://twitter.com/ScottMorrisonMP/status/700213110695546880
2016-02-17 21:01:39,ScottMorrisonMP,,5,1,4,"Live in the studio with @m_brisso on @amworldtodaypm #auspolpic.twitter.com/BuSPxOwgHR",,@m_brisso @amworldtodaypm,#auspolpic,700062578861428736,https://twitter.com/ScottMorrisonMP/status/700062578861428736
2016-02-17 20:14:00,ScottMorrisonMP,,6,0,1,"About to be interviewed by #AlanJones on @2GB873 listen live http://www.2gb.com/listen-live",,@2GB873,#AlanJones,700050583864999936,https://twitter.com/ScottMorrisonMP/status/700050583864999936
2016-02-17 19:59:50,ScottMorrisonMP,,15,1,3,"Speaking to @kochie_online on @sunriseon7 in a few moments about the Govts plan to back Australians who are working, saving & investing",,@kochie_online @sunriseon7,,700047020438847488,https://twitter.com/ScottMorrisonMP/status/700047020438847488
2016-02-17 19:45:36,ScottMorrisonMP,,0,2,5,"Tune in to @TheTodayShow I'm speaking to @Lisa_Wilkinson about our transitioning economy #auspol",,@TheTodayShow @Lisa_Wilkinson,#auspol,700043438562025472,https://twitter.com/ScottMorrisonMP/status/700043438562025472
