date,username,to,replies,retweets,favorites,text,geo,mentions,hashtags,id,permalink
2019-02-16 01:30:32,ScottMorrisonMP,,123,45,197,"Our Government is committed to supporting all Australia’s traditional industries, including forestry. Today I’m in Northern Tasmania with @richardmcolbeck to announce new support for forestry jobs with details of 9 new regional forestry hubs across Australia under our $20m plan.pic.twitter.com/mzooyM1fsx",,@richardmcolbeck,,1096582567526973445,https://twitter.com/ScottMorrisonMP/status/1096582567526973445
2019-02-15 06:01:56,ScottMorrisonMP,,151,68,352,"Today I've seen the devastation firsthand that has hit so much of North West Queensland. There are a lot of strong people here but they need our support. We're backing them.pic.twitter.com/cFcCtMGuKz",,,,1096288480789839872,https://twitter.com/ScottMorrisonMP/status/1096288480789839872
2019-02-15 02:26:09,ScottMorrisonMP,,111,61,287,"Up in Cloncurry, Queensland today meeting with flood affected farmers and communities and to see the scale of the damage firsthand. Some truly heartbreaking scenes. We will stand with all those affected as you recover and rebuild.pic.twitter.com/RYRCvYi01A",,,,1096234177731514368,https://twitter.com/ScottMorrisonMP/status/1096234177731514368
2019-02-15 00:27:37,ScottMorrisonMP,,110,1272,3938,"Australia condemns the heinous terrorist attack on an Indian police convoy in Jammu and Kashmir. We convey our deepest condolences to the families of the victims, and all those injured. Our thoughts are with my friend Prime Minister @narendramodi and the Indian people.",,@narendramodi,,1096204348823023616,https://twitter.com/ScottMorrisonMP/status/1096204348823023616
2019-02-14 02:23:54,ScottMorrisonMP,,109,104,352,"Welcome home, Hakeem. It was a pleasure to meet you today. Thank you to everyone who helped get you home, to @Craig_Foster for leading the charge, the Thai Government and people for their understanding, and to the Bahraini Government for its constructive dialogue to resolve this.pic.twitter.com/ihB4UeHFpC",,@Craig_Foster,,1095871222313758720,https://twitter.com/ScottMorrisonMP/status/1095871222313758720
2019-02-13 22:08:21,ScottMorrisonMP,,99,39,177,"Received this photo from Longford Station outside of Cloncurry this morning. I was there less than two years ago, when it was dry red dust. We will be standing with all those affected as you recover and rebuild.pic.twitter.com/MebgOJrf1m",,,,1095806910249357312,https://twitter.com/ScottMorrisonMP/status/1095806910249357312
2019-02-13 21:29:58,ScottMorrisonMP,australian,189,70,390,"My focus is on wanting to get kids in schools and to stay in school for longer.https://twitter.com/australian/status/1095788613919432704 …",,,,1095797252251996160,https://twitter.com/ScottMorrisonMP/status/1095797252251996160
2019-02-13 21:26:29,ScottMorrisonMP,A_Sinodinos,63,8,87,"Great to have you back in Parliament this week @A_Sinodinos!https://twitter.com/A_Sinodinos/status/1095635814225047552 …",,@A_Sinodinos,,1095796375906770944,https://twitter.com/ScottMorrisonMP/status/1095796375906770944
2019-02-13 04:33:58,ScottMorrisonMP,,76,22,93,"We will never lose focus on the plight of our farmers who are doing it tough, whether by floods or drought, and we will continue to stand by them.",,,,1095541568805564416,https://twitter.com/ScottMorrisonMP/status/1095541568805564416
2019-02-13 04:33:08,ScottMorrisonMP,,207,48,204,"Everyday I'm focused on the challenges being faced by the Australian people. And that means the drought that continues to worsen & spread. Earlier today, I met with Minister @D_LittleproudMP & Major General Day to get an update on the implementation of our drought action plan.pic.twitter.com/z6Z1JzkDCN",,@D_LittleproudMP,,1095541357790150656,https://twitter.com/ScottMorrisonMP/status/1095541357790150656
2019-02-13 00:40:38,ScottMorrisonMP,,573,106,532,"It’s my job now to ensure the boats don't come back. I will to do everything within the Government’s power to ensure that what the Labor Party has done to weaken our borders does not result in boats coming to Australia.",,,,1095482847677140992,https://twitter.com/ScottMorrisonMP/status/1095482847677140992
2019-02-13 00:40:02,ScottMorrisonMP,,671,159,704,"Today I convened a meeting of the National Security Committee. I have adopted the advice of our security and border protection officials to reopen the Christmas Island detention centre. We're taking this action to clean up the mess Bill Shorten & Labor made yesterday, once again.pic.twitter.com/KhvqrzaTf3",,,,1095482695495249920,https://twitter.com/ScottMorrisonMP/status/1095482695495249920
2019-02-12 21:41:48,ScottMorrisonMP,,22,28,141,"Ovarian cancer is the most deadly cancer for women in Australia. Today 4 women will be diagnosed with it and sadly 3 of them will die from it. We will continue to fight this disease and to fight alongside every women diagnosed with it #ovariancancer #tealribbon",,,#ovariancancer #tealribbon,1095437840618405888,https://twitter.com/ScottMorrisonMP/status/1095437840618405888
2019-02-12 21:40:06,ScottMorrisonMP,,53,36,187,"Today I announced $1.6m new funding for support services for women with ovarian cancer & their care givers. This adds to our investment into research & new medicines #OCAM2019 @OvarianCancerOzpic.twitter.com/vR7x5U165N",,@OvarianCancerOzpic,#OCAM2019,1095437413625749506,https://twitter.com/ScottMorrisonMP/status/1095437413625749506
2019-02-12 08:58:50,ScottMorrisonMP,,453,141,681,"Our border protection framework works. We stopped the boats, stopped the deaths at sea, closed the detention centres, removed all children from detention and from Nauru. Tonight Labor have demonstrated again they just don’t understand how to protect Australia’s borders.",,,,1095245835053363200,https://twitter.com/ScottMorrisonMP/status/1095245835053363200
2019-02-12 08:56:11,ScottMorrisonMP,,751,285,1253,"Bill Shorten and the Labor Party have demonstrated tonight they do not have the mettle to protect our borders. They have learned nothing from their past failures and cannot be trusted to keep our borders and Australia strong.",,,,1095245168964395008,https://twitter.com/ScottMorrisonMP/status/1095245168964395008
2019-02-11 22:01:39,ScottMorrisonMP,,68,54,285,"[2/2] We have also appreciated the constructive dialogue we’ve had with Bahrain to resolve this. We look forward to seeing you home, Hakeem.",,,,1095080447984291840,https://twitter.com/ScottMorrisonMP/status/1095080447984291840
2019-02-11 22:01:38,ScottMorrisonMP,,151,261,1296,"[1/2] Hakeem al-Araibi is on his way home to his wife and family. I want to thank all Australians for their support in achieveing this outcome. We are grateful to the Thai Government and thank them for the way they have engaged with us to enable Hakeem to return to Australia.pic.twitter.com/PfrMhmDB0z",,,,1095080444922449920,https://twitter.com/ScottMorrisonMP/status/1095080444922449920
2019-02-11 02:02:25,ScottMorrisonMP,,227,34,199,"Only a re-elected Liberal-National Government will continue to keep Australians safe and secure #StrongerAus",,,#StrongerAus,1094778653454458880,https://twitter.com/ScottMorrisonMP/status/1094778653454458880
2019-02-11 02:01:58,ScottMorrisonMP,,158,43,237,"National security is all about making the right decisions. We have the mettle to make the right calls on our nation’s security. We have led, not followed. The plan I’ve announced today builds on our Government’s strong record #StrongerAus",,,#StrongerAus,1094778537834205184,https://twitter.com/ScottMorrisonMP/status/1094778537834205184
2019-02-11 01:52:52,ScottMorrisonMP,,31,20,88,"It builds on the more than $350m our Government has invested since 2015. Violence against women must stop #StrongerAus",,,#StrongerAus,1094776248511778816,https://twitter.com/ScottMorrisonMP/status/1094776248511778816
2019-02-11 01:52:15,ScottMorrisonMP,,67,46,139,"Today we’ve announced $78m to help hundreds of women & children escaping from domestic and family violence by giving them a safe place to sleep #StrongerAuspic.twitter.com/8wTWcWtxxB",,,#StrongerAuspic,1094776095428075520,https://twitter.com/ScottMorrisonMP/status/1094776095428075520
2019-02-11 01:50:16,ScottMorrisonMP,,58,45,142,"The achievement we can all take most comfort from is that since 2014, our security agencies have disrupted 14 major terrorist plots. That’s keeping Australia safe #StrongerAuspic.twitter.com/vj9TPTqfOJ",,,#StrongerAuspic,1094775593416052736,https://twitter.com/ScottMorrisonMP/status/1094775593416052736
2019-02-11 01:40:17,ScottMorrisonMP,,359,76,356,"Today I am releasing our plan to keep Australians safe and secure. It builds on our achievements & addresses the new and emerging threats we face #StrongerAuspic.twitter.com/JG0IAW2w30",,,#StrongerAuspic,1094773082936434689,https://twitter.com/ScottMorrisonMP/status/1094773082936434689
2019-02-11 01:38:22,ScottMorrisonMP,,43,18,90,"Every day we have been taking action to build a stronger and even more resilient Australia to deal with whatever comes at us #StrongerAus",,,#StrongerAus,1094772598418726912,https://twitter.com/ScottMorrisonMP/status/1094772598418726912
2019-02-11 01:37:33,ScottMorrisonMP,,47,30,144,"For the past five and a half years, our Government has taken our national security & safety responsibilities extremely seriously, dealing with the world as it is #StrongerAus",,,#StrongerAus,1094772392952397825,https://twitter.com/ScottMorrisonMP/status/1094772392952397825
2019-02-11 01:17:19,ScottMorrisonMP,,119,22,109,"I’m about to deliver a speech in Canberra on protecting Australia & keeping Australians safe. It’ll be #LIVE on my Facebook in about 15 mins so make sure you tune in at: https://www.facebook.com/scottmorrison4cook/ … #StrongerAus",,,#LIVE #StrongerAus,1094767301516132353,https://twitter.com/ScottMorrisonMP/status/1094767301516132353
2019-02-11 00:03:24,ScottMorrisonMP,,530,123,534,"Today is a defining moment for Australia with the formal signing of a $50b agreement to build 12 submarines in Australia for the Navy. This agreement will create around 2,800 jobs for Australians, while helping to protect our country and keep Australians safe. #StrongerAuspic.twitter.com/TqGDIgn95T",,,#StrongerAuspic,1094748703045300224,https://twitter.com/ScottMorrisonMP/status/1094748703045300224
2019-02-08 11:27:40,ScottMorrisonMP,,249,47,270,"Congrats, @paulgallen13. Great win turning off Hoppa’s porch light tonight. #upupcronulla",,@paulgallen13,#upupcronulla,1093833737475809280,https://twitter.com/ScottMorrisonMP/status/1093833737475809280
2019-02-08 07:04:47,ScottMorrisonMP,,31,12,73,"[4/4] We will also provide an additional $3 million to boost mental health support in these areas, complementing the work also being done by the Qld Gov.",,,,1093767582279032833,https://twitter.com/ScottMorrisonMP/status/1093767582279032833
2019-02-08 07:04:47,ScottMorrisonMP,,6,7,59,"[3/4] This can be used for things like the hiring and leasing of equipment, disposing damaged goods and equipment, purchasing fodder, salvaging feed or crops, repairing essential plant and equipment.",,,,1093767580618092544,https://twitter.com/ScottMorrisonMP/status/1093767580618092544
2019-02-08 07:04:46,ScottMorrisonMP,,4,7,28,"[2/4] We have moved with the Qld Gov to provide Category D assistance, which includes increasing the grants available to farmers in the 9 seriously affected shires from $25k to $75k each.",,,,1093767579116593152,https://twitter.com/ScottMorrisonMP/status/1093767579116593152
2019-02-08 07:04:46,ScottMorrisonMP,,42,30,148,"[1/4] Update on Nth Qld floods: Today I announced the Fed Gov would increase our relief and recovery support by an additional $100 million.",,,,1093767577665363968,https://twitter.com/ScottMorrisonMP/status/1093767577665363968
2019-02-08 00:31:31,ScottMorrisonMP,,18,12,69,"[2/2] Fodder drops are being coordinated by local shires based on their direct contact with the farmers on the stations. We are supporting and responding to the directions from the Shires.",,,,1093668615318949889,https://twitter.com/ScottMorrisonMP/status/1093668615318949889
2019-02-08 00:31:31,ScottMorrisonMP,,16,12,78,"[1/2] Updates: We have already approved upgrade to Category C assistance across the impacted areas. Further support now being assessed. Again working closely with Qld Govt.",,,,1093668613481848832,https://twitter.com/ScottMorrisonMP/status/1093668613481848832
2019-02-07 23:23:16,ScottMorrisonMP,,46,24,93,"Cloncurry Mayor Greg Campbell sent me this pic this morning. Heartbreaking stuff. Have convened urgent meetings today with all mayors, Defence and emergency mgt agencies to coordinate our response. Working closely with Qld Premier.pic.twitter.com/3Mg4Rrx9mz",,,,1093651439031705601,https://twitter.com/ScottMorrisonMP/status/1093651439031705601
2019-02-07 06:00:42,ScottMorrisonMP,,13,12,69,"[4/4] On this day, we remember the community spirit that shone through in the darkest of hours.",,,,1093389068333793281,https://twitter.com/ScottMorrisonMP/status/1093389068333793281
2019-02-07 06:00:42,ScottMorrisonMP,,5,10,75,"[3/4] We also remember and honour those who gave their time and efforts to protect and serve both their neighbours and strangers - whether it was through the emergency services, the ADF, the AFP or volunteering. Thank you for your service.",,,,1093389066442235904,https://twitter.com/ScottMorrisonMP/status/1093389066442235904
2019-02-07 06:00:41,ScottMorrisonMP,,1,9,25,"[2/4] While we have rebuilt our communities, I know that there are voids in the hearts of many family and friends who lost loved ones and who were impacted by the fires.",,,,1093389064504369152,https://twitter.com/ScottMorrisonMP/status/1093389064504369152
2019-02-07 06:00:40,ScottMorrisonMP,,27,24,107,"[1/4] Ten years ago today, the Black Saturday Bushfires in Victoria took the lives of 173 people and many thousands more were impacted - over 2,000 homes were destroyed.pic.twitter.com/FfR6grCFvY",,,,1093389060192710656,https://twitter.com/ScottMorrisonMP/status/1093389060192710656
2019-02-05 22:48:05,ScottMorrisonMP,,37,14,45,"[4/4] These are active now and fully funded – information and applications are through the Queensland Government’s Community Recovery Hotline on 1800 173 349 or on their website.",,,,1092917808269127680,https://twitter.com/ScottMorrisonMP/status/1092917808269127680
2019-02-05 22:48:05,ScottMorrisonMP,,5,13,42,"[3/4] - Help for damage to housing to make it secure, safe and habitable – up to $10,995 for single adults and up to $14,685 for couples/families. -Help to safely reconnect essential services – up to $5000 available.",,,,1092917806406877187,https://twitter.com/ScottMorrisonMP/status/1092917806406877187
2019-02-05 22:48:04,ScottMorrisonMP,,6,9,20,"[2/4] - Help for loss of essential services like power or water - $150 per person, up to $750 for a family of 5 or more. -Help for loss of essential household goods where people do not have insurance – up to $1,765 for single adults and up to $3,500 for couples/families.",,,,1092917804368461824,https://twitter.com/ScottMorrisonMP/status/1092917804368461824
2019-02-05 22:48:03,ScottMorrisonMP,ScottMorrisonMP,21,22,53,"[1/4] This is not the only payment available. The Federal Government jointly funds a range of relief and recovery assistance for individuals and families, including: -Help for immediate emergency needs - $180 per person, up to $900 for a family of 5 or more.https://twitter.com/ScottMorrisonMP/status/1092913252026085376 …",,,,1092917801419911168,https://twitter.com/ScottMorrisonMP/status/1092917801419911168
2019-02-05 22:29:59,ScottMorrisonMP,,43,41,155,"[2/2] People in Townsville are now eligible for the Federal Government’s Disaster Recovery Payment if water has gone over floorboards in their house. That’s all, 25% rule gone. People can claim the payment by contacting the DHS on 180 22 66.",,,,1092913252026085376,https://twitter.com/ScottMorrisonMP/status/1092913252026085376
2019-02-05 22:29:58,ScottMorrisonMP,,109,58,243,"[1/2] After seeing firsthand the challenges faced in Townsville yesterday, I asked for changes to be made last night to the eligibility for the disaster relief payment. Have listened and acted.",,,,1092913249639575553,https://twitter.com/ScottMorrisonMP/status/1092913249639575553
2019-02-03 01:44:45,ScottMorrisonMP,,385,68,364,"[2/2] Our strong border protection policies have enabled us to secure our borders, stop the boats and the tragic drownings at sea while getting children out of detention and off Nauru without putting our stronger borders at risk. We have got the balance right.",,,,1091875102847717376,https://twitter.com/ScottMorrisonMP/status/1091875102847717376
2019-02-03 01:44:25,ScottMorrisonMP,,559,143,651,"[1/2] With the last four children booked to leave for the US, every asylum seeker child will now be off Nauru.pic.twitter.com/yp17a8S1sR",,,,1091875020362534912,https://twitter.com/ScottMorrisonMP/status/1091875020362534912
2019-01-31 00:12:11,ScottMorrisonMP,7NewsSydney,141,38,219,"Well done, guys. All the best.https://twitter.com/7NewsSydney/status/1090729782172516352 …",,,,1090764645890023424,https://twitter.com/ScottMorrisonMP/status/1090764645890023424
2019-01-29 23:23:57,ScottMorrisonMP,,323,135,507,". @Bowenchris finally making some sense.pic.twitter.com/JLtkrFHWXH",,@Bowenchris,,1090390117955457024,https://twitter.com/ScottMorrisonMP/status/1090390117955457024
2019-01-29 03:18:43,ScottMorrisonMP,,100,18,76,"Investments that will mean families can get around the table at night for their evening meal, parents can get home to help their kids with their homework, people with small business can spend more time on the job rather than stuck in traffic #StrongerAus",,,#StrongerAus,1090086810259152896,https://twitter.com/ScottMorrisonMP/status/1090086810259152896
2019-01-29 03:17:49,ScottMorrisonMP,,80,28,91,"Today here in South East Queensland, I’m announcing we’re committing more money to local congestion-busting road and rail projects #StrongerAuspic.twitter.com/4ibDft04Iz",,,#StrongerAuspic,1090086585100464128,https://twitter.com/ScottMorrisonMP/status/1090086585100464128
2019-01-29 03:05:04,ScottMorrisonMP,,132,29,144,"Today I’m making a new pledge for our Government, to see 1.25 million jobs created over the next 5 years #StrongerAus",,,#StrongerAus,1090083375321296897,https://twitter.com/ScottMorrisonMP/status/1090083375321296897
2019-01-29 03:04:14,ScottMorrisonMP,,297,78,401,"When we were first elected to government we said we’d create 1 million jobs in 5 years. And we did exactly that. When we make commitments we keep them #StrongerAus",,,#StrongerAus,1090083166168088576,https://twitter.com/ScottMorrisonMP/status/1090083166168088576
2019-01-29 02:59:11,ScottMorrisonMP,,26,16,73,"These treatments help everyone – from those dealing with diabetes, to Parkinson’s disease, multiple sclerosis, breast cancer, ovarian and lung cancer #StrongerAus",,,#StrongerAus,1090081898179620864,https://twitter.com/ScottMorrisonMP/status/1090081898179620864
2019-01-29 02:58:31,ScottMorrisonMP,,50,45,127,"This is what a stronger economy does. It pays for the essential services that Australians rely on #StrongerAuspic.twitter.com/T7B5ASAG9I",,,#StrongerAuspic,1090081727534354432,https://twitter.com/ScottMorrisonMP/status/1090081727534354432
2019-01-29 02:39:25,ScottMorrisonMP,,164,29,149,"I’m about to deliver my first economic speech of the year in Brisbane in about 15 mins. It’ll be #LIVE on my Facebook so make sure you tune in https://www.facebook.com/scottmorrison4cook/ … #StrongerAus",,,#LIVE #StrongerAus,1090076921176645632,https://twitter.com/ScottMorrisonMP/status/1090076921176645632
2019-01-28 22:17:26,ScottMorrisonMP,,143,31,140,"The number of young people in jobs is also at its best level, ever. And we now have the lowest level of working-age Australians on welfare in 30 years #StrongerAus",,,#StrongerAus,1090010993231446016,https://twitter.com/ScottMorrisonMP/status/1090010993231446016
2019-01-28 22:14:20,ScottMorrisonMP,,70,25,116,"Our government is already delivering the same high employment economy the Howard Government delivered - 1.2m more Australians in jobs in the last 5.5 years #StrongerAus",,,#StrongerAus,1090010213606875138,https://twitter.com/ScottMorrisonMP/status/1090010213606875138
2019-01-28 20:15:13,ScottMorrisonMP,,534,84,400,"Today I’ve made a new jobs pledge under our Government. We’re for jobs. They’re proof of our ability to manage and deliver a stronger economy. A job creating economy makes stronger families and stronger communities #StrongerAuspic.twitter.com/Xpx6EGe4O1",,,#StrongerAuspic,1089980234881937409,https://twitter.com/ScottMorrisonMP/status/1089980234881937409
2019-01-25 20:20:10,ScottMorrisonMP,,881,360,1814,"Happy Australia Day! Today is the day we come together to celebrate our great nation. We are stronger and better together.pic.twitter.com/GVNTq76714",,,,1088894314904604672,https://twitter.com/ScottMorrisonMP/status/1088894314904604672
2019-01-25 09:53:23,ScottMorrisonMP,,111,153,832,"Congrats to Dr Richard Harris and Dr Craig Challen on being jointly awarded Australian of the Year. Humble heroes who put their own lives at risk in an international effort to rescue 12 young boys and soccer coach trapped in a flooded cave in Thailand last year. You did us proud.pic.twitter.com/y7yL2OHaMa",,,,1088736580678733824,https://twitter.com/ScottMorrisonMP/status/1088736580678733824
2019-01-24 05:36:09,ScottMorrisonMP,DylanAlcott,44,15,110,"Great job, Dylan. We're all with you! https://twitter.com/DylanAlcott/status/1088287773134442496 …",,,,1088309460999725059,https://twitter.com/ScottMorrisonMP/status/1088309460999725059
2019-01-24 03:19:34,ScottMorrisonMP,,183,58,243,"More than a quarter of a million Australians got a job in 2018, which shows our plan to deliver a stronger economy is working. That brings the total number of jobs created under our government to 1.2 million.",,,,1088275087822807040,https://twitter.com/ScottMorrisonMP/status/1088275087822807040
2019-01-24 03:19:33,ScottMorrisonMP,,296,101,529,"Unemployment in Australia is now at its lowest rate in over 7 years. More than 730 jobs were created every day last year under our government – that’s the benefit of a strong economy.pic.twitter.com/sQOTqbBK7v",,,,1088275084052066305,https://twitter.com/ScottMorrisonMP/status/1088275084052066305
2019-01-23 06:42:08,ScottMorrisonMP,,113,15,128,"Warren will fight hard to build on your local work - guaranteeing essential services, delivering important infrastructure projects, getting more Australians into jobs and keeping the economy strong.pic.twitter.com/ohnmzmyqt7",,,,1087963676055928832,https://twitter.com/ScottMorrisonMP/status/1087963676055928832
2019-01-23 06:42:05,ScottMorrisonMP,,189,52,317,"Welcome to the team, Warren Mundine, and a big thanks to Ann Sudmalis for all the work you have done for the South Coast in Gilmore.pic.twitter.com/iZjdyvodQ4",,,,1087963664248913920,https://twitter.com/ScottMorrisonMP/status/1087963664248913920
2019-01-22 20:46:23,ScottMorrisonMP,,669,129,545,"A stronger economy guarantees the essential services that you and your family rely on. Higher taxes will slow you and the economy down which is why the Liberal National Government is committed to keeping taxes low and the economy strong.pic.twitter.com/aXuhxjQrVT",,,,1087813749539393536,https://twitter.com/ScottMorrisonMP/status/1087813749539393536
2019-01-22 09:46:31,ScottMorrisonMP,,63,18,214,"You’re a champion, Ash - congratulations on a great tournament. Big things ahead and we’re with you.",,,,1087647691838869504,https://twitter.com/ScottMorrisonMP/status/1087647691838869504
2019-01-22 06:49:43,ScottMorrisonMP,,93,37,414,"All the best, @ashbar96. So proud of what you have achieved. We’re all with you tonight! #AusOpenpic.twitter.com/zw3lsrpI1C",,@ashbar96,#AusOpenpic,1087603195499532289,https://twitter.com/ScottMorrisonMP/status/1087603195499532289
2019-01-21 04:41:48,ScottMorrisonMP,,436,49,363,"Thanks to Shane Flanagan for his great service and contribution to the Sharks and our local Shire community. I wish you and your family all the best, Flano - our greatest coach and wonderful family man who made our community an even better place.",,,,1087208618192121856,https://twitter.com/ScottMorrisonMP/status/1087208618192121856
2019-01-21 04:15:29,ScottMorrisonMP,,49,18,109,"Our Government is acting to take the pressure off Cairns Hospital’s waiting lists and clinical services with a $60 million investment in Stage 1 of the Cairns University Hospital. #StrongerAuspic.twitter.com/8EFMvtsUfE",,,#StrongerAuspic,1087201996900200449,https://twitter.com/ScottMorrisonMP/status/1087201996900200449
2019-01-20 20:20:33,ScottMorrisonMP,,362,79,452,"We’re backing young tennis stars of the future. After witnessing a fantastic win for Ash Barty yesterday, I’m proud to announce that around 3000 girls will get support to stretch their tennis skills with a $12 million boost from the Liberal National Government.pic.twitter.com/3b28JvML88",,,,1087082475883442176,https://twitter.com/ScottMorrisonMP/status/1087082475883442176
2019-01-20 07:23:08,ScottMorrisonMP,,561,90,1053,"How good is @ashbar96! pic.twitter.com/Taxsr6LcWX",,@ashbar96,,1086886832229380097,https://twitter.com/ScottMorrisonMP/status/1086886832229380097
2019-01-20 03:47:26,ScottMorrisonMP,,142,81,410,"Today we announced subsidies for a life-saving lung cancer treatment. Help is on the way for hundreds of Australians. We can fund medicines like this because our Government’s plan to deliver a stronger economy and bring the Budget back into balance is working.pic.twitter.com/NBomnFqiZe",,,,1086832546426413057,https://twitter.com/ScottMorrisonMP/status/1086832546426413057
